Name	Protein id	Contig id	Start	Stop	Strand	Element symbol	Element name	Scope	Type	Subtype	Class	Subclass	Method	Target length	Reference sequence length	% Coverage of reference	% Identity to reference	Alignment length	Closest reference accession	Closest reference name	HMM accession	HMM description
ERR16718619	ERR16718619_04334	gnl|Bactopia|ERR16718619_53	32024	32920	+	pcoB	copper-binding protein PcoB	plus	STRESS	METAL	COPPER	COPPER	BLASTP	298	296	100.00	100.00	296	CAA58526.1	copper-binding protein PcoB	NA	NA
ERR16718619	ERR16718619_04335	gnl|Bactopia|ERR16718619_53	32960	33340	+	pcoC	copper resistance system metallochaperone PcoC	plus	STRESS	METAL	COPPER	COPPER	EXACTP	126	126	100.00	100.00	126	CAA58527.1	copper resistance system metallochaperone PcoC	NA	NA
ERR16718619	ERR16718619_04336	gnl|Bactopia|ERR16718619_53	33345	34274	+	pcoD	copper resistance inner membrane protein PcoD	plus	STRESS	METAL	COPPER	COPPER	BLASTP	309	309	100.00	99.68	309	CAA58528.1	copper resistance inner membrane protein PcoD	NA	NA
ERR16718619	ERR16718619_04337	gnl|Bactopia|ERR16718619_53	34329	35009	+	pcoR	copper response regulator transcription factor PcoR	plus	STRESS	METAL	COPPER	COPPER	EXACTP	226	226	100.00	100.00	226	CAA58529.1	copper response regulator transcription factor PcoR	NA	NA
ERR16718619	ERR16718619_04338	gnl|Bactopia|ERR16718619_53	35006	36406	+	pcoS	copper resistance membrane spanning protein PcoS	plus	STRESS	METAL	COPPER	COPPER	BLASTP	466	466	100.00	99.36	466	CAA58530.1	copper resistance membrane spanning protein PcoS	NA	NA
ERR16718619	ERR16718619_04339	gnl|Bactopia|ERR16718619_53	36624	37058	+	pcoE	copper resistance system metallochaperone PcoE	plus	STRESS	METAL	COPPER	COPPER	BLASTP	144	144	100.00	97.92	144	CAA58532.1	copper resistance system metallochaperone PcoE	NA	NA
ERR16718619	ERR16718619_00966	gnl|Bactopia|ERR16718619_6	106197	106433	+	asr	acid resistance repetitive basic protein Asr	plus	STRESS	ACID	NA	NA	HMM	78	102	100.00	52.94	102	BAA15331.2	acid resistance repetitive basic protein Asr	NF033636.1	acid resistance repetitive basic protein Asr
ERR16718619	ERR16718619_04782	gnl|Bactopia|ERR16718619_68	11073	11648	-	terE	tellurium resistance cAMP binding protein TerE	plus	STRESS	METAL	TELLURIUM	TELLURIUM	BLASTP	191	191	100.00	99.48	191	AAA98293.1	tellurium resistance cAMP binding protein TerE	NA	NA
ERR16718619	ERR16718619_04783	gnl|Bactopia|ERR16718619_68	11735	12313	-	terD	tellurium resistance membrane protein TerD	plus	STRESS	METAL	TELLURIUM	TELLURIUM	BLASTP	192	192	100.00	98.96	192	AAA98292.1	tellurium resistance membrane protein TerD	NA	NA
ERR16718619	ERR16718619_04784	gnl|Bactopia|ERR16718619_68	12352	13392	-	terC	tellurium resistance membrane protein TerC	plus	STRESS	METAL	TELLURIUM	TELLURIUM	BLASTP	346	346	100.00	99.13	346	AAA98291.1	tellurium resistance membrane protein TerC	NA	NA
ERR16718619	ERR16718619_04785	gnl|Bactopia|ERR16718619_68	13416	13871	-	terB	tellurium resistance membrane protein TerB	plus	STRESS	METAL	TELLURIUM	TELLURIUM	EXACTP	151	151	100.00	100.00	151	ACI12150.1	tellurium resistance membrane protein TerB	NA	NA
ERR16718619	ERR16718619_04786	gnl|Bactopia|ERR16718619_68	13894	15045	-	terA	tellurium resistance system protein TerA	plus	STRESS	METAL	NA	NA	BLASTP	383	383	100.00	99.48	383	AHE47495.1	tellurium resistance system protein TerA	NA	NA
ERR16718619	ERR16718619_05158	gnl|Bactopia|ERR16718619_85	7501	7926	-	arsC	glutaredoxin-dependent arsenate reductase	plus	STRESS	METAL	ARSENIC	ARSENATE	BLASTP	141	141	100.00	99.29	141	BAA24824.1	glutaredoxin-dependent arsenate reductase	NF007456.1	glutaredoxin-dependent arsenate reductase
ERR16718619	ERR16718619_05159	gnl|Bactopia|ERR16718619_85	7939	9228	-	arsB	arsenite efflux transporter membrane subunit ArsB	plus	STRESS	METAL	ARSENIC	ARSENITE	BLASTP	429	429	100.00	98.83	429	BAA24823.1	arsenite efflux transporter membrane subunit ArsB	NA	NA
ERR16718619	ERR16718619_05160	gnl|Bactopia|ERR16718619_85	9276	11027	-	arsA	arsenite efflux transporter ATPase subunit ArsA	plus	STRESS	METAL	ARSENIC	ARSENITE	BLASTP	583	583	100.00	98.80	583	BAA24822.1	arsenite efflux transporter ATPase subunit ArsA	NA	NA
ERR16718619	ERR16718619_05161	gnl|Bactopia|ERR16718619_85	11045	11407	-	arsD	arsenite efflux transporter metallochaperone ArsD	plus	STRESS	METAL	ARSENIC	ARSENITE	BLASTP	120	120	100.00	90.83	120	AAB09625.1	arsenite efflux transporter metallochaperone ArsD	NF033727.2	arsenite efflux transporter metallochaperone ArsD
ERR16718619	ERR16718619_05162	gnl|Bactopia|ERR16718619_85	11459	11809	-	arsR	As(III)-sensing metalloregulatory transcriptional repressor ArsR	plus	STRESS	METAL	ARSENIC	ARSENIC	BLASTP	116	116	100.00	98.28	116	AET17094.1	As(III)-sensing metalloregulatory transcriptional repressor ArsR	NA	NA
ERR16718619	ERR16718619_05227	gnl|Bactopia|ERR16718619_89	10927	11352	-	arsC	glutaredoxin-dependent arsenate reductase	plus	STRESS	METAL	ARSENIC	ARSENATE	BLASTP	141	141	99.29	90.00	140	AAA21096.1	glutaredoxin-dependent arsenate reductase	NF007456.1	glutaredoxin-dependent arsenate reductase
ERR16718619	ERR16718619_05232	gnl|Bactopia|ERR16718619_90	84	1406	-	merA	mercury(II) reductase	plus	STRESS	METAL	MERCURY	MERCURY	PARTIALP	440	561	77.90	91.53	437	ACU65296.1	mercury(II) reductase	NA	NA
ERR16718619	ERR16718619_05233	gnl|Bactopia|ERR16718619_90	1445	1870	-	merC	organomercurial transporter MerC	plus	STRESS	METAL	MERCURY	ORGANOMERCURY	HMM	141	141	100.00	80.14	141	AAC38233.1	organomercurial transporter MerC	NF033784.1	organomercurial transporter MerC
ERR16718619	ERR16718619_05234	gnl|Bactopia|ERR16718619_90	1898	2173	-	merP	mercury resistance system periplasmic binding protein MerP	plus	STRESS	METAL	MERCURY	MERCURY	HMM	91	91	100.00	85.71	91	AAC38219.1	mercury resistance system periplasmic binding protein MerP	TIGR02052.1	mercury resistance system periplasmic binding protein MerP
ERR16718619	ERR16718619_05235	gnl|Bactopia|ERR16718619_90	2189	2554	-	merT	mercuric transport protein MerT	plus	STRESS	METAL	MERCURY	MERCURY	BLASTP	121	116	99.14	98.26	115	CAA70196.1	mercuric transport protein MerT	NA	NA
ERR16718619	ERR16718619_05236	gnl|Bactopia|ERR16718619_90	2626	3081	+	merR	mercury resistance transcriptional regulator MerR	plus	STRESS	METAL	MERCURY	MERCURY	BLASTP	151	144	98.61	92.96	142	CAA77320.1	mercury resistance transcriptional regulator MerR	NF010315.0	mercury resistance transcriptional regulator MerR
ERR16718620	ERR16718620_00271	gnl|Bactopia|ERR16718620_1	297276	297695	-	fosA	FosA5 family fosfomycin resistance glutathione transferase	core	AMR	AMR	FOSFOMYCIN	FOSFOMYCIN	BLASTP	139	139	100.00	99.28	139	WP_004146118.1	FosA5 family fosfomycin resistance glutathione transferase	NF040540.1	FosA5 family fosfomycin resistance glutathione transferase
ERR16718620	ERR16718620_02587	gnl|Bactopia|ERR16718620_16	22746	23168	-	arsC	glutaredoxin-dependent arsenate reductase	plus	STRESS	METAL	ARSENIC	ARSENATE	HMM	140	141	98.58	78.42	139	AAA21096.1	glutaredoxin-dependent arsenate reductase	NF007456.1	glutaredoxin-dependent arsenate reductase
ERR16718620	ERR16718620_02734	gnl|Bactopia|ERR16718620_17	47816	48676	+	blaSHV-11	broad-spectrum class A beta-lactamase SHV-11	core	AMR	AMR	BETA-LACTAM	BETA-LACTAM	ALLELEP	286	286	100.00	100.00	286	WP_004176269.1	broad-spectrum class A beta-lactamase SHV-11	NF000285.3	SHV family class A beta-lactamase
ERR16718620	ERR16718620_03038	gnl|Bactopia|ERR16718620_20	39709	40611	-	fieF	CDF family cation-efflux transporter FieF	plus	STRESS	METAL	NA	NA	EXACTP	300	300	100.00	100.00	300	BAB89353.1	CDF family cation-efflux transporter FieF	NA	NA
ERR16718620	ERR16718620_00597	gnl|Bactopia|ERR16718620_3	79848	81032	-	emrD	multidrug efflux MFS transporter EmrD	plus	AMR	AMR	EFFLUX	EFFLUX	BLASTP	394	394	100.00	99.49	394	ACN65732.1	multidrug efflux MFS transporter EmrD	NA	NA
ERR16718620	ERR16718620_04293	gnl|Bactopia|ERR16718620_37	23761	24642	+	blaKPC-2	carbapenem-hydrolyzing class A beta-lactamase KPC-2	core	AMR	AMR	BETA-LACTAM	CARBAPENEM	ALLELEP	293	293	100.00	100.00	293	WP_004199234.1	carbapenem-hydrolyzing class A beta-lactamase KPC-2	NF012141.1	KPC family carbapenem-hydrolyzing class A beta-lactamase
ERR16718620	NA	gnl|Bactopia|ERR16718620_37	34304	35125	+	blaOXA	OXA-9 family oxacillin-hydrolyzing class D beta-lactamase	core	AMR	AMR	BETA-LACTAM	BETA-LACTAM	INTERNAL_STOP	274	274	100.00	99.64	274	WP_000722315.1	oxacillin-hydrolyzing class D beta-lactamase OXA-9	NA	NA
ERR16718620	ERR16718620_04301	gnl|Bactopia|ERR16718620_37	35828	36688	+	blaTEM-1	broad-spectrum class A beta-lactamase TEM-1	core	AMR	AMR	BETA-LACTAM	BETA-LACTAM	ALLELEP	286	286	100.00	100.00	286	WP_000027057.1	broad-spectrum class A beta-lactamase TEM-1	NF000531.2	TEM family class A beta-lactamase
ERR16718620	ERR16718620_04305	gnl|Bactopia|ERR16718620_37	39303	39539	-	merE	broad-spectrum mercury transporter MerE	plus	STRESS	METAL	MERCURY	MERCURY	HMM	78	78	100.00	78.21	78	AAA88371.1	broad-spectrum mercury transporter MerE	NF010310.2	broad-spectrum mercury transporter MerE
ERR16718620	ERR16718620_04306	gnl|Bactopia|ERR16718620_37	39536	39898	-	merD	mercury resistance co-regulator MerD	plus	STRESS	METAL	MERCURY	MERCURY	HMM	120	121	100.00	82.64	121	AAC38221.1	mercury resistance co-regulator MerD	NF033783.1	mercury resistance co-regulator MerD
ERR16718620	ERR16718620_04307	gnl|Bactopia|ERR16718620_37	39916	41610	-	merA	mercury(II) reductase	plus	STRESS	METAL	MERCURY	MERCURY	HMM	564	561	100.00	85.31	565	AAC38220.1	mercury(II) reductase	TIGR02053.1	mercury(II) reductase
ERR16718620	ERR16718620_04308	gnl|Bactopia|ERR16718620_37	41662	42084	-	merC	organomercurial transporter MerC	plus	STRESS	METAL	MERCURY	ORGANOMERCURY	EXACTP	140	140	100.00	100.00	140	AAC33908.1	organomercurial transporter MerC	NF033784.1	organomercurial transporter MerC
ERR16718620	ERR16718620_04410	gnl|Bactopia|ERR16718620_40	22802	25954	-	oqxB	multidrug efflux RND transporter permease subunit OqxB	core	AMR	AMR	PHENICOL/QUINOLONE	PHENICOL/QUINOLONE	EXACTP	1050	1050	100.00	100.00	1050	WP_000347934.1	multidrug efflux RND transporter permease subunit OqxB	NF000037.1	multidrug efflux RND transporter permease subunit OqxB
ERR16718620	ERR16718620_04411	gnl|Bactopia|ERR16718620_40	25978	27153	-	oqxA	multidrug efflux RND transporter periplasmic adaptor subunit OqxA	core	AMR	AMR	PHENICOL/QUINOLONE	PHENICOL/QUINOLONE	EXACTP	391	391	100.00	100.00	391	WP_002914189.1	multidrug efflux RND transporter periplasmic adaptor subunit OqxA	NF000272.1	multidrug efflux RND transporter periplasmic adaptor subunit OqxA
ERR16718620	ERR16718620_04428	gnl|Bactopia|ERR16718620_41	1445	2014	+	hsp20	small heat shock protein sHSP20	plus	STRESS	HEAT	NA	NA	BLASTP	189	189	100.00	99.47	189	CDY80020.1	small heat shock protein sHSP20	NA	NA
ERR16718620	ERR16718620_04429	gnl|Bactopia|ERR16718620_41	2120	4969	+	clpK	heat shock survival AAA family ATPase ClpK	plus	STRESS	HEAT	NA	NA	BLASTP	949	949	100.00	98.74	949	ASF80763.1	heat shock survival AAA family ATPase ClpK	NF033606.1	heat shock survival AAA family ATPase ClpK
ERR16718620	ERR16718620_04433	gnl|Bactopia|ERR16718620_41	6115	6573	+	shsP	small heat shock protein sHSP20-GI	plus	STRESS	HEAT	NA	NA	BLASTP	152	152	100.00	99.34	152	ASF80771.1	small heat shock protein sHSP20-GI	NA	NA
ERR16718620	ERR16718620_04434	gnl|Bactopia|ERR16718620_41	6596	7510	+	yfdX1	heat resistance protein YfdX1	plus	STRESS	HEAT	NA	NA	BLASTP	304	304	100.00	99.34	304	APX31172.1	heat resistance protein YfdX1	NA	NA
ERR16718620	ERR16718620_04435	gnl|Bactopia|ERR16718620_41	7613	8500	+	yfdX2	heat resistance protein YfdX2	plus	STRESS	HEAT	NA	NA	BLASTP	295	295	100.00	98.98	295	ASF80766.1	heat resistance protein YfdX2	NA	NA
ERR16718620	ERR16718620_04436	gnl|Bactopia|ERR16718620_41	8590	9231	+	hdeD-GI	heat resistance membrane protein HdeD-GI	plus	STRESS	HEAT	NA	NA	BLASTP	213	203	100.00	96.06	203	APX31174.1	heat resistance membrane protein HdeD-GI	NA	NA
ERR16718620	ERR16718620_04438	gnl|Bactopia|ERR16718620_41	10415	10855	+	trxLHR	heat resistance system thioredoxin Trx-GI	plus	STRESS	HEAT	NA	NA	BLASTP	146	146	100.00	98.63	146	APX31176.1	heat resistance system thioredoxin Trx-GI	NA	NA
ERR16718620	ERR16718620_04439	gnl|Bactopia|ERR16718620_41	10859	12568	+	kefB-GI	heat resistance system K+/H+ antiporter KefB-GI	plus	STRESS	HEAT	NA	NA	INTERNAL_STOP	569	571	99.65	99.12	569	APX31177.1	heat resistance system K+/H+ antiporter KefB-GI	NA	NA
ERR16718620	ERR16718620_04440	gnl|Bactopia|ERR16718620_41	12571	13068	+	psi-GI	heat resistance protein PsiE-GI	plus	STRESS	HEAT	NA	NA	BLASTP	165	165	100.00	95.76	165	APX31178.1	heat resistance protein PsiE-GI	NA	NA
ERR16718620	ERR16718620_04631	gnl|Bactopia|ERR16718620_47	5350	6750	-	pcoS	copper resistance membrane spanning protein PcoS	plus	STRESS	METAL	COPPER	COPPER	BLASTP	466	466	100.00	99.14	466	CAA58530.1	copper resistance membrane spanning protein PcoS	NA	NA
ERR16718620	ERR16718620_04632	gnl|Bactopia|ERR16718620_47	6747	7427	-	pcoR	copper response regulator transcription factor PcoR	plus	STRESS	METAL	COPPER	COPPER	EXACTP	226	226	100.00	100.00	226	CAA58529.1	copper response regulator transcription factor PcoR	NA	NA
ERR16718620	ERR16718620_04633	gnl|Bactopia|ERR16718620_47	7482	8411	-	pcoD	copper resistance inner membrane protein PcoD	plus	STRESS	METAL	COPPER	COPPER	BLASTP	309	309	100.00	99.35	309	CAA58528.1	copper resistance inner membrane protein PcoD	NA	NA
ERR16718620	ERR16718620_04634	gnl|Bactopia|ERR16718620_47	8416	8796	-	pcoC	copper resistance system metallochaperone PcoC	plus	STRESS	METAL	COPPER	COPPER	EXACTP	126	126	100.00	100.00	126	CAA58527.1	copper resistance system metallochaperone PcoC	NA	NA
ERR16718620	ERR16718620_04635	gnl|Bactopia|ERR16718620_47	8836	9732	-	pcoB	copper-binding protein PcoB	plus	STRESS	METAL	COPPER	COPPER	BLASTP	298	296	100.00	100.00	296	CAA58526.1	copper-binding protein PcoB	NA	NA
ERR16718620	ERR16718620_04636	gnl|Bactopia|ERR16718620_47	9732	11549	-	pcoA	multicopper oxidase PcoA	plus	STRESS	METAL	COPPER	COPPER	EXACTP	605	605	100.00	100.00	605	CAA58525.1	multicopper oxidase PcoA	NA	NA
ERR16718620	ERR16718620_04640	gnl|Bactopia|ERR16718620_47	13530	15977	-	silP	Ag(+)-translocating P-type ATPase SilP	plus	STRESS	METAL	SILVER	SILVER	BLASTP	815	824	98.79	94.61	816	AAD11750.1	Ag(+)-translocating P-type ATPase SilP	NA	NA
ERR16718620	ERR16718620_04642	gnl|Bactopia|ERR16718620_47	16631	19777	-	silA	Cu(+)/Ag(+) efflux RND transporter permease subunit SilA	plus	STRESS	METAL	COPPER/SILVER	COPPER/SILVER	BLASTP	1048	1048	100.00	98.85	1048	AAD11749.1	Cu(+)/Ag(+) efflux RND transporter permease subunit SilA	NA	NA
ERR16718620	ERR16718620_04643	gnl|Bactopia|ERR16718620_47	19788	21080	-	silB	Cu(+)/Ag(+) efflux RND transporter periplasmic adaptor subunit SilB	plus	STRESS	METAL	COPPER/SILVER	COPPER/SILVER	BLASTP	430	430	100.00	97.91	430	AAD11748.1	Cu(+)/Ag(+) efflux RND transporter periplasmic adaptor subunit SilB	NA	NA
ERR16718620	ERR16718620_04644	gnl|Bactopia|ERR16718620_47	21194	21547	-	silF	Cu(+)/Ag(+) efflux RND transporter periplasmic metallochaperone SilF	plus	STRESS	METAL	COPPER/SILVER	COPPER/SILVER	BLASTP	117	117	100.00	99.15	117	KGL71342.1	Cu(+)/Ag(+) efflux RND transporter periplasmic metallochaperone SilF	NA	NA
ERR16718620	ERR16718620_04645	gnl|Bactopia|ERR16718620_47	21576	22961	-	silC	Cu(+)/Ag(+) efflux RND transporter outer membrane channel SilC	plus	STRESS	METAL	COPPER/SILVER	COPPER/SILVER	BLASTP	461	461	100.00	99.78	461	SPD96884.1	Cu(+)/Ag(+) efflux RND transporter outer membrane channel SilC	NA	NA
ERR16718620	ERR16718620_04646	gnl|Bactopia|ERR16718620_47	23151	23831	+	silR	copper/silver response regulator transcription factor SilR	plus	STRESS	METAL	COPPER/SILVER	COPPER/SILVER	EXACTP	226	226	100.00	100.00	226	SPD96883.1	copper/silver response regulator transcription factor SilR	NA	NA
ERR16718620	ERR16718620_04647	gnl|Bactopia|ERR16718620_47	23824	25299	+	silS	copper/silver sensor histidine kinase SilS	plus	STRESS	METAL	COPPER/SILVER	COPPER/SILVER	EXACTP	491	491	100.00	100.00	491	SPD96882.1	copper/silver sensor histidine kinase SilS	NA	NA
ERR16718620	ERR16718620_04648	gnl|Bactopia|ERR16718620_47	25550	25981	+	silE	silver-binding protein SilE	plus	STRESS	METAL	SILVER	SILVER	BLASTP	143	143	100.00	96.50	143	AAD11743.1	silver-binding protein SilE	NA	NA
ERR16718620	ERR16718620_04932	gnl|Bactopia|ERR16718620_58	2572	3387	-	aph(3')-Ia	aminoglycoside O-phosphotransferase APH(3')-Ia	core	AMR	AMR	AMINOGLYCOSIDE	KANAMYCIN	BLASTP	271	271	100.00	99.63	271	WP_000018326.1	aminoglycoside O-phosphotransferase APH(3')-Ia	NF051474.1	aminoglycoside O-phosphotransferase APH(3')-Ia
ERR16718620	ERR16718620_04946	gnl|Bactopia|ERR16718620_58	13621	14796	-	blaRSC1	RSC1 family class C beta-lactamase	core	AMR	AMR	BETA-LACTAM	CEPHALOSPORIN	BLASTP	391	396	98.74	91.82	391	WP_128268282.1	class C beta-lactamase RSC1-1	NF033085.1	class C beta-lactamase
ERR16718620	ERR16718620_01602	gnl|Bactopia|ERR16718620_8	98436	99668	+	kdeA	multidrug efflux MFS transporter KdeA	plus	AMR	AMR	EFFLUX	EFFLUX	EXACTP	410	410	100.00	100.00	410	ABR76310.1	multidrug efflux MFS transporter KdeA	NA	NA
ERR16718626	ERR16718626_03602	gnl|Bactopia|ERR16718626_15	71078	72310	+	kdeA	multidrug efflux MFS transporter KdeA	plus	AMR	AMR	EFFLUX	EFFLUX	EXACTP	410	410	100.00	100.00	410	ABR76310.1	multidrug efflux MFS transporter KdeA	NA	NA
ERR16718626	ERR16718626_04057	gnl|Bactopia|ERR16718626_19	39709	40611	-	fieF	CDF family cation-efflux transporter FieF	plus	STRESS	METAL	NA	NA	EXACTP	300	300	100.00	100.00	300	BAB89353.1	CDF family cation-efflux transporter FieF	NA	NA
ERR16718626	ERR16718626_04386	gnl|Bactopia|ERR16718626_23	22746	23168	-	arsC	glutaredoxin-dependent arsenate reductase	plus	STRESS	METAL	ARSENIC	ARSENATE	HMM	140	141	98.58	78.42	139	AAA21096.1	glutaredoxin-dependent arsenate reductase	NF007456.1	glutaredoxin-dependent arsenate reductase
ERR16718626	ERR16718626_04645	gnl|Bactopia|ERR16718626_28	11387	11884	-	psi-GI	heat resistance protein PsiE-GI	plus	STRESS	HEAT	NA	NA	BLASTP	165	165	100.00	95.76	165	APX31178.1	heat resistance protein PsiE-GI	NA	NA
ERR16718626	ERR16718626_04646	gnl|Bactopia|ERR16718626_28	11887	13596	-	kefB-GI	heat resistance system K+/H+ antiporter KefB-GI	plus	STRESS	HEAT	NA	NA	INTERNAL_STOP	569	571	99.65	99.12	569	APX31177.1	heat resistance system K+/H+ antiporter KefB-GI	NA	NA
ERR16718626	ERR16718626_04647	gnl|Bactopia|ERR16718626_28	13600	14040	-	trxLHR	heat resistance system thioredoxin Trx-GI	plus	STRESS	HEAT	NA	NA	BLASTP	146	146	100.00	98.63	146	APX31176.1	heat resistance system thioredoxin Trx-GI	NA	NA
ERR16718626	ERR16718626_04649	gnl|Bactopia|ERR16718626_28	15224	15865	-	hdeD-GI	heat resistance membrane protein HdeD-GI	plus	STRESS	HEAT	NA	NA	BLASTP	213	203	100.00	96.06	203	APX31174.1	heat resistance membrane protein HdeD-GI	NA	NA
ERR16718626	ERR16718626_04650	gnl|Bactopia|ERR16718626_28	15955	16842	-	yfdX2	heat resistance protein YfdX2	plus	STRESS	HEAT	NA	NA	BLASTP	295	295	100.00	98.98	295	ASF80766.1	heat resistance protein YfdX2	NA	NA
ERR16718626	ERR16718626_04651	gnl|Bactopia|ERR16718626_28	16945	17859	-	yfdX1	heat resistance protein YfdX1	plus	STRESS	HEAT	NA	NA	BLASTP	304	304	100.00	99.34	304	APX31172.1	heat resistance protein YfdX1	NA	NA
ERR16718626	ERR16718626_04652	gnl|Bactopia|ERR16718626_28	17882	18340	-	shsP	small heat shock protein sHSP20-GI	plus	STRESS	HEAT	NA	NA	BLASTP	152	152	100.00	99.34	152	ASF80771.1	small heat shock protein sHSP20-GI	NA	NA
ERR16718626	ERR16718626_04656	gnl|Bactopia|ERR16718626_28	19486	22335	-	clpK	heat shock survival AAA family ATPase ClpK	plus	STRESS	HEAT	NA	NA	BLASTP	949	949	100.00	98.74	949	ASF80763.1	heat shock survival AAA family ATPase ClpK	NF033606.1	heat shock survival AAA family ATPase ClpK
ERR16718626	ERR16718626_04657	gnl|Bactopia|ERR16718626_28	22441	23010	-	hsp20	small heat shock protein sHSP20	plus	STRESS	HEAT	NA	NA	BLASTP	189	189	100.00	99.47	189	CDY80020.1	small heat shock protein sHSP20	NA	NA
ERR16718626	ERR16718626_00841	gnl|Bactopia|ERR16718626_3	79750	80610	+	blaSHV-11	broad-spectrum class A beta-lactamase SHV-11	core	AMR	AMR	BETA-LACTAM	BETA-LACTAM	ALLELEP	286	286	100.00	100.00	286	WP_004176269.1	broad-spectrum class A beta-lactamase SHV-11	NF000285.3	SHV family class A beta-lactamase
ERR16718626	ERR16718626_04725	gnl|Bactopia|ERR16718626_30	23749	24630	+	blaKPC-2	carbapenem-hydrolyzing class A beta-lactamase KPC-2	core	AMR	AMR	BETA-LACTAM	CARBAPENEM	ALLELEP	293	293	100.00	100.00	293	WP_004199234.1	carbapenem-hydrolyzing class A beta-lactamase KPC-2	NF012141.1	KPC family carbapenem-hydrolyzing class A beta-lactamase
ERR16718626	NA	gnl|Bactopia|ERR16718626_30	34292	35113	+	blaOXA	OXA-9 family oxacillin-hydrolyzing class D beta-lactamase	core	AMR	AMR	BETA-LACTAM	BETA-LACTAM	INTERNAL_STOP	274	274	100.00	99.64	274	WP_000722315.1	oxacillin-hydrolyzing class D beta-lactamase OXA-9	NA	NA
ERR16718626	ERR16718626_04828	gnl|Bactopia|ERR16718626_34	5349	6749	-	pcoS	copper resistance membrane spanning protein PcoS	plus	STRESS	METAL	COPPER	COPPER	BLASTP	466	466	100.00	99.14	466	CAA58530.1	copper resistance membrane spanning protein PcoS	NA	NA
ERR16718626	ERR16718626_04829	gnl|Bactopia|ERR16718626_34	6746	7426	-	pcoR	copper response regulator transcription factor PcoR	plus	STRESS	METAL	COPPER	COPPER	EXACTP	226	226	100.00	100.00	226	CAA58529.1	copper response regulator transcription factor PcoR	NA	NA
ERR16718626	ERR16718626_04830	gnl|Bactopia|ERR16718626_34	7481	8410	-	pcoD	copper resistance inner membrane protein PcoD	plus	STRESS	METAL	COPPER	COPPER	BLASTP	309	309	100.00	99.35	309	CAA58528.1	copper resistance inner membrane protein PcoD	NA	NA
ERR16718626	ERR16718626_04831	gnl|Bactopia|ERR16718626_34	8415	8795	-	pcoC	copper resistance system metallochaperone PcoC	plus	STRESS	METAL	COPPER	COPPER	EXACTP	126	126	100.00	100.00	126	CAA58527.1	copper resistance system metallochaperone PcoC	NA	NA
ERR16718626	ERR16718626_04832	gnl|Bactopia|ERR16718626_34	8835	9731	-	pcoB	copper-binding protein PcoB	plus	STRESS	METAL	COPPER	COPPER	BLASTP	298	296	100.00	100.00	296	CAA58526.1	copper-binding protein PcoB	NA	NA
ERR16718626	ERR16718626_04833	gnl|Bactopia|ERR16718626_34	9731	11548	-	pcoA	multicopper oxidase PcoA	plus	STRESS	METAL	COPPER	COPPER	EXACTP	605	605	100.00	100.00	605	CAA58525.1	multicopper oxidase PcoA	NA	NA
ERR16718626	ERR16718626_04837	gnl|Bactopia|ERR16718626_34	13529	15976	-	silP	Ag(+)-translocating P-type ATPase SilP	plus	STRESS	METAL	SILVER	SILVER	BLASTP	815	824	98.79	94.61	816	AAD11750.1	Ag(+)-translocating P-type ATPase SilP	NA	NA
ERR16718626	ERR16718626_04839	gnl|Bactopia|ERR16718626_34	16630	19776	-	silA	Cu(+)/Ag(+) efflux RND transporter permease subunit SilA	plus	STRESS	METAL	COPPER/SILVER	COPPER/SILVER	BLASTP	1048	1048	100.00	98.85	1048	AAD11749.1	Cu(+)/Ag(+) efflux RND transporter permease subunit SilA	NA	NA
ERR16718626	ERR16718626_04840	gnl|Bactopia|ERR16718626_34	19787	21079	-	silB	Cu(+)/Ag(+) efflux RND transporter periplasmic adaptor subunit SilB	plus	STRESS	METAL	COPPER/SILVER	COPPER/SILVER	BLASTP	430	430	100.00	97.91	430	AAD11748.1	Cu(+)/Ag(+) efflux RND transporter periplasmic adaptor subunit SilB	NA	NA
ERR16718626	ERR16718626_04841	gnl|Bactopia|ERR16718626_34	21193	21546	-	silF	Cu(+)/Ag(+) efflux RND transporter periplasmic metallochaperone SilF	plus	STRESS	METAL	COPPER/SILVER	COPPER/SILVER	BLASTP	117	117	100.00	99.15	117	KGL71342.1	Cu(+)/Ag(+) efflux RND transporter periplasmic metallochaperone SilF	NA	NA
ERR16718626	ERR16718626_04842	gnl|Bactopia|ERR16718626_34	21575	22960	-	silC	Cu(+)/Ag(+) efflux RND transporter outer membrane channel SilC	plus	STRESS	METAL	COPPER/SILVER	COPPER/SILVER	BLASTP	461	461	100.00	99.78	461	SPD96884.1	Cu(+)/Ag(+) efflux RND transporter outer membrane channel SilC	NA	NA
ERR16718626	ERR16718626_04843	gnl|Bactopia|ERR16718626_34	23150	23830	+	silR	copper/silver response regulator transcription factor SilR	plus	STRESS	METAL	COPPER/SILVER	COPPER/SILVER	EXACTP	226	226	100.00	100.00	226	SPD96883.1	copper/silver response regulator transcription factor SilR	NA	NA
ERR16718626	ERR16718626_04844	gnl|Bactopia|ERR16718626_34	23823	25298	+	silS	copper/silver sensor histidine kinase SilS	plus	STRESS	METAL	COPPER/SILVER	COPPER/SILVER	EXACTP	491	491	100.00	100.00	491	SPD96882.1	copper/silver sensor histidine kinase SilS	NA	NA
ERR16718626	ERR16718626_04845	gnl|Bactopia|ERR16718626_34	25549	25980	+	silE	silver-binding protein SilE	plus	STRESS	METAL	SILVER	SILVER	BLASTP	143	143	100.00	96.50	143	AAD11743.1	silver-binding protein SilE	NA	NA
ERR16718626	ERR16718626_01422	gnl|Bactopia|ERR16718626_4	306303	309455	-	oqxB	multidrug efflux RND transporter permease subunit OqxB	core	AMR	AMR	PHENICOL/QUINOLONE	PHENICOL/QUINOLONE	EXACTP	1050	1050	100.00	100.00	1050	WP_000347934.1	multidrug efflux RND transporter permease subunit OqxB	NF000037.1	multidrug efflux RND transporter permease subunit OqxB
ERR16718626	ERR16718626_01423	gnl|Bactopia|ERR16718626_4	309479	310654	-	oqxA	multidrug efflux RND transporter periplasmic adaptor subunit OqxA	core	AMR	AMR	PHENICOL/QUINOLONE	PHENICOL/QUINOLONE	EXACTP	391	391	100.00	100.00	391	WP_002914189.1	multidrug efflux RND transporter periplasmic adaptor subunit OqxA	NF000272.1	multidrug efflux RND transporter periplasmic adaptor subunit OqxA
ERR16718626	ERR16718626_05024	gnl|Bactopia|ERR16718626_41	313	1128	-	aph(3')-Ia	aminoglycoside O-phosphotransferase APH(3')-Ia	core	AMR	AMR	AMINOGLYCOSIDE	KANAMYCIN	BLASTP	271	271	100.00	99.63	271	WP_000018326.1	aminoglycoside O-phosphotransferase APH(3')-Ia	NF051474.1	aminoglycoside O-phosphotransferase APH(3')-Ia
ERR16718626	ERR16718626_05038	gnl|Bactopia|ERR16718626_41	11362	12537	-	blaRSC1	RSC1 family class C beta-lactamase	core	AMR	AMR	BETA-LACTAM	CEPHALOSPORIN	BLASTP	391	396	98.74	91.82	391	WP_128268282.1	class C beta-lactamase RSC1-1	NF033085.1	class C beta-lactamase
