Name	Protein id	Contig id	Start	Stop	Strand	Element symbol	Element name	Scope	Type	Subtype	Class	Subclass	Method	Target length	Reference sequence length	% Coverage of reference	% Identity to reference	Alignment length	Closest reference accession	Closest reference name	HMM accession	HMM description
ERR16718582	ERR16718582_00303	gnl|Bactopia|ERR16718582_1	320541	321773	-	kdeA	multidrug efflux MFS transporter KdeA	plus	AMR	AMR	EFFLUX	EFFLUX	BLASTP	410	410	100.00	99.51	410	ABR76310.1	multidrug efflux MFS transporter KdeA	NA	NA
ERR16718582	ERR16718582_03463	gnl|Bactopia|ERR16718582_12	137535	139247	+	ybtP	yersiniabactin ABC transporter ATP-binding/permease protein YbtP	plus	VIRULENCE	VIRULENCE	NA	NA	BLASTP	570	600	95.00	99.65	570	CAA21388.1	yersiniabactin ABC transporter ATP-binding/permease protein YbtP	NA	NA
ERR16718582	ERR16718582_03464	gnl|Bactopia|ERR16718582_12	139234	141036	+	ybtQ	yersiniabactin ABC transporter ATP-binding/permease protein YbtQ	plus	VIRULENCE	VIRULENCE	NA	NA	BLASTP	600	600	100.00	99.83	600	AAC69584.1	yersiniabactin ABC transporter ATP-binding/permease protein YbtQ	NA	NA
ERR16718582	ERR16718582_03818	gnl|Bactopia|ERR16718582_14	114628	115488	+	blaSHV-11	broad-spectrum class A beta-lactamase SHV-11	core	AMR	AMR	BETA-LACTAM	BETA-LACTAM	ALLELEP	286	286	100.00	100.00	286	WP_004176269.1	broad-spectrum class A beta-lactamase SHV-11	NF000285.3	SHV family class A beta-lactamase
ERR16718582	ERR16718582_04025	gnl|Bactopia|ERR16718582_15	144426	144848	-	fosA	FosA5 family fosfomycin resistance glutathione transferase	core	AMR	AMR	FOSFOMYCIN	FOSFOMYCIN	BLASTP	140	139	99.28	99.28	138	WP_004146118.1	FosA5 family fosfomycin resistance glutathione transferase	NF040540.1	FosA5 family fosfomycin resistance glutathione transferase
ERR16718582	ERR16718582_01033	gnl|Bactopia|ERR16718582_2	400179	401363	+	emrD	multidrug efflux MFS transporter EmrD	plus	AMR	AMR	EFFLUX	EFFLUX	BLASTP	394	394	100.00	99.49	394	ACN65732.1	multidrug efflux MFS transporter EmrD	NA	NA
ERR16718582	ERR16718582_04530	gnl|Bactopia|ERR16718582_20	39711	40613	-	fieF	CDF family cation-efflux transporter FieF	plus	STRESS	METAL	NA	NA	EXACTP	300	300	100.00	100.00	300	BAB89353.1	CDF family cation-efflux transporter FieF	NA	NA
ERR16718582	ERR16718582_05060	gnl|Bactopia|ERR16718582_27	27000	27476	+	dfrA50	trimethoprim-resistant dihydrofolate reductase DfrA50	core	AMR	AMR	TRIMETHOPRIM	TRIMETHOPRIM	BLASTP	158	158	100.00	98.73	158	WP_040203768.1	trimethoprim-resistant dihydrofolate reductase DfrA50	NF047323.1	trimethoprim-resistant dihydrofolate reductase DfrA50
ERR16718582	ERR16718582_01149	gnl|Bactopia|ERR16718582_3	30794	31969	+	oqxA	multidrug efflux RND transporter periplasmic adaptor subunit OqxA	core	AMR	AMR	PHENICOL/QUINOLONE	PHENICOL/QUINOLONE	EXACTP	391	391	100.00	100.00	391	WP_002914189.1	multidrug efflux RND transporter periplasmic adaptor subunit OqxA	NF000272.1	multidrug efflux RND transporter periplasmic adaptor subunit OqxA
ERR16718582	ERR16718582_01150	gnl|Bactopia|ERR16718582_3	31993	35145	+	oqxB	multidrug efflux RND transporter permease subunit OqxB	core	AMR	AMR	PHENICOL/QUINOLONE	PHENICOL/QUINOLONE	BLASTP	1050	1050	100.00	99.81	1050	WP_016947602.1	multidrug efflux RND transporter permease subunit OqxB25	NF000037.1	multidrug efflux RND transporter permease subunit OqxB
ERR16718582	ERR16718582_01483	gnl|Bactopia|ERR16718582_3	380763	381185	-	arsC	glutaredoxin-dependent arsenate reductase	plus	STRESS	METAL	ARSENIC	ARSENATE	HMM	140	141	98.58	79.14	139	AAA21096.1	glutaredoxin-dependent arsenate reductase	NF007456.1	glutaredoxin-dependent arsenate reductase
ERR16718582	ERR16718582_05474	gnl|Bactopia|ERR16718582_40	2820	3695	+	blaCTX-M-14	extended-spectrum class A beta-lactamase CTX-M-14	core	AMR	AMR	BETA-LACTAM	CEPHALOSPORIN	ALLELEP	291	291	100.00	100.00	291	WP_001617865.1	extended-spectrum class A beta-lactamase CTX-M-14	NF033089.1	CTX-M family extended-spectrum class A beta-lactamase
ERR16718582	ERR16718582_05547	gnl|Bactopia|ERR16718582_42	13450	14079	-	aph(6)-Id	aminoglycoside O-phosphotransferase APH(6)-Id	core	AMR	AMR	AMINOGLYCOSIDE	STREPTOMYCIN	PARTIALP	209	278	75.18	99.52	209	WP_000480968.1	aminoglycoside O-phosphotransferase APH(6)-Id	NA	NA
ERR16718582	ERR16718582_05568	gnl|Bactopia|ERR16718582_45	770	1402	+	catB	type B chloramphenicol O-acetyltransferase	core	AMR	AMR	PHENICOL	CHLORAMPHENICOL	EXACTP	210	210	100.00	100.00	210	WP_031281281.1	type B chloramphenicol O-acetyltransferase	NF000490.1	type B chloramphenicol O-acetyltransferase
ERR16718582	ERR16718582_05570	gnl|Bactopia|ERR16718582_45	3051	3830	-	rmtF1	16S rRNA (guanine(1405)-N(7))-methyltransferase RmtF1	core	AMR	AMR	AMINOGLYCOSIDE	AMINOGLYCOSIDE	ALLELEP	259	259	100.00	100.00	259	WP_015632396.1	16S rRNA (guanine(1405)-N(7))-methyltransferase RmtF1	NF000113.1	RmtF family 16S rRNA (guanine(1405)-N(7))-methyltransferase
ERR16718582	ERR16718582_05571	gnl|Bactopia|ERR16718582_45	4241	4795	-	aac(6')-Ib	AAC(6')-Ib family aminoglycoside 6'-N-acetyltransferase	core	AMR	AMR	AMINOGLYCOSIDE	GENTAMICIN	EXACTP	184	184	100.00	100.00	184	WP_022631510.1	AAC(6')-Ib family aminoglycoside 6'-N-acetyltransferase	NF033074.0	AAC(6')-Ib family aminoglycoside 6'-N-acetyltransferase
ERR16718582	ERR16718582_05573	gnl|Bactopia|ERR16718582_45	6850	7302	-	arr-2	NAD(+)--rifampin ADP-ribosyltransferase Arr-2	core	AMR	AMR	RIFAMYCIN	RIFAMYCIN	ALLELEP	150	150	100.00	100.00	150	WP_000237816.1	NAD(+)--rifampin ADP-ribosyltransferase Arr-2	NF033144.1	NAD(+)--rifampin ADP-ribosyltransferase
ERR16718582	ERR16718582_05617	gnl|Bactopia|ERR16718582_55	1022	2260	-	mrx(A)	phosphorylated macrolide efflux MFS transporter Mrx(A)	core	AMR	AMR	MACROLIDE	AZITHROMYCIN/ERYTHROMYCIN/SPIRAMYCIN/TELITHROMYCIN	EXACTP	412	412	100.00	100.00	412	WP_000004159.1	phosphorylated macrolide efflux MFS transporter Mrx(A)	NA	NA
ERR16718582	ERR16718582_05618	gnl|Bactopia|ERR16718582_55	2257	3171	-	mph(A)	Mph(A) family macrolide 2'-phosphotransferase	core	AMR	AMR	MACROLIDE	AZITHROMYCIN/ERYTHROMYCIN/SPIRAMYCIN/TELITHROMYCIN	BLASTP	304	301	100.00	100.00	301	WP_000219391.1	Mph(A) family macrolide 2'-phosphotransferase	NF000254.1	Mph(A) family macrolide 2'-phosphotransferase
ERR16718582	ERR16718582_05624	gnl|Bactopia|ERR16718582_57	950	1789	-	sul1	sulfonamide-resistant dihydropteroate synthase Sul1	core	AMR	AMR	SULFONAMIDE	SULFONAMIDE	EXACTP	279	279	100.00	100.00	279	WP_000259031.1	sulfonamide-resistant dihydropteroate synthase Sul1	NF000294.1	sulfonamide-resistant dihydropteroate synthase Sul1
ERR16718582	ERR16718582_05625	gnl|Bactopia|ERR16718582_57	1783	2130	-	qacEdelta1	quaternary ammonium compound efflux SMR transporter QacE delta 1	core	STRESS	BIOCIDE	QUATERNARY AMMONIUM	QUATERNARY AMMONIUM	ALLELEP	115	115	100.00	100.00	115	WP_000679427.1	quaternary ammonium compound efflux SMR transporter QacE delta 1	NF000276.2	quaternary ammonium compound efflux SMR transporter QacE
ERR16718582	NA	gnl|Bactopia|ERR16718582_57	2317	2787	-	dfrA5	trimethoprim-resistant dihydrofolate reductase DfrA5	core	AMR	AMR	TRIMETHOPRIM	TRIMETHOPRIM	EXACTX	157	157	100.00	100.00	157	WP_001317507.1	trimethoprim-resistant dihydrofolate reductase DfrA5	NF000330.1	trimethoprim-resistant dihydrofolate reductase DfrA
ERR16718582	ERR16718582_02332	gnl|Bactopia|ERR16718582_6	192872	193165	+	asr	acid resistance repetitive basic protein Asr	plus	STRESS	ACID	NA	NA	HMM	97	102	100.00	64.15	106	BAA15331.2	acid resistance repetitive basic protein Asr	NF033636.1	acid resistance repetitive basic protein Asr
ERR16718582	ERR16718582_05638	gnl|Bactopia|ERR16718582_61	1536	2333	-	blaOXA-48	OXA-48 family carbapenem-hydrolyzing class D beta-lactamase OXA-48	core	AMR	AMR	BETA-LACTAM	CARBAPENEM	ALLELEP	265	265	100.00	100.00	265	WP_015059991.1	OXA-48 family carbapenem-hydrolyzing class D beta-lactamase OXA-48	NF000387.2	OXA-48 family class D beta-lactamase
ERR16718582	ERR16718582_05642	gnl|Bactopia|ERR16718582_65	147	1007	-	blaTEM-1	broad-spectrum class A beta-lactamase TEM-1	core	AMR	AMR	BETA-LACTAM	BETA-LACTAM	ALLELEP	286	286	100.00	100.00	286	WP_000027057.1	broad-spectrum class A beta-lactamase TEM-1	NF000531.2	TEM family class A beta-lactamase
ERR16718582	ERR16718582_05648	gnl|Bactopia|ERR16718582_68	129	932	-	aph(3'')-Ib	aminoglycoside O-phosphotransferase APH(3'')-Ib	core	AMR	AMR	AMINOGLYCOSIDE	STREPTOMYCIN	EXACTP	267	267	100.00	100.00	267	WP_001082319.1	aminoglycoside O-phosphotransferase APH(3'')-Ib	NF032895.1	aminoglycoside O-phosphotransferase APH(3'')-Ib
ERR16718582	ERR16718582_05653	gnl|Bactopia|ERR16718582_72	718	1362	+	qnrB1	quinolone resistance pentapeptide repeat protein QnrB1	core	AMR	AMR	QUINOLONE	QUINOLONE	ALLELEP	214	214	100.00	100.00	214	WP_014386481.1	quinolone resistance pentapeptide repeat protein QnrB1	NF000420.1	QnrB family quinolone resistance pentapeptide repeat protein
ERR16718582	ERR16718582_05660	gnl|Bactopia|ERR16718582_78	619	1050	-	catA1	type A-1 chloramphenicol O-acetyltransferase	core	AMR	AMR	PHENICOL	CHLORAMPHENICOL	PARTIALP	143	219	65.30	100.00	143	WP_000412211.1	type A-1 chloramphenicol O-acetyltransferase	NA	NA
ERR16718582	ERR16718582_05661	gnl|Bactopia|ERR16718582_79	137	952	-	aph(3')-Ia	aminoglycoside O-phosphotransferase APH(3')-Ia	core	AMR	AMR	AMINOGLYCOSIDE	KANAMYCIN	EXACTP	271	271	100.00	100.00	271	WP_000018329.1	aminoglycoside O-phosphotransferase APH(3')-Ia	NF051474.1	aminoglycoside O-phosphotransferase APH(3')-Ia
ERR16718597	ERR16718597_00301	gnl|Bactopia|ERR16718597_1	320998	322230	-	kdeA	multidrug efflux MFS transporter KdeA	plus	AMR	AMR	EFFLUX	EFFLUX	BLASTP	410	410	100.00	99.51	410	ABR76310.1	multidrug efflux MFS transporter KdeA	NA	NA
ERR16718597	ERR16718597_03509	gnl|Bactopia|ERR16718597_13	114628	115488	+	blaSHV-11	broad-spectrum class A beta-lactamase SHV-11	core	AMR	AMR	BETA-LACTAM	BETA-LACTAM	ALLELEP	286	286	100.00	100.00	286	WP_004176269.1	broad-spectrum class A beta-lactamase SHV-11	NF000285.3	SHV family class A beta-lactamase
ERR16718597	ERR16718597_03715	gnl|Bactopia|ERR16718597_14	144477	144899	-	fosA	FosA5 family fosfomycin resistance glutathione transferase	core	AMR	AMR	FOSFOMYCIN	FOSFOMYCIN	BLASTP	140	139	99.28	99.28	138	WP_004146118.1	FosA5 family fosfomycin resistance glutathione transferase	NF040540.1	FosA5 family fosfomycin resistance glutathione transferase
ERR16718597	ERR16718597_03962	gnl|Bactopia|ERR16718597_16	90722	91906	-	emrD	multidrug efflux MFS transporter EmrD	plus	AMR	AMR	EFFLUX	EFFLUX	BLASTP	394	394	100.00	99.49	394	ACN65732.1	multidrug efflux MFS transporter EmrD	NA	NA
ERR16718597	ERR16718597_04110	gnl|Bactopia|ERR16718597_18	25448	25924	+	dfrA50	trimethoprim-resistant dihydrofolate reductase DfrA50	core	AMR	AMR	TRIMETHOPRIM	TRIMETHOPRIM	BLASTP	158	158	100.00	98.73	158	WP_040203768.1	trimethoprim-resistant dihydrofolate reductase DfrA50	NF047323.1	trimethoprim-resistant dihydrofolate reductase DfrA50
ERR16718597	ERR16718597_00702	gnl|Bactopia|ERR16718597_2	30794	31969	+	oqxA	multidrug efflux RND transporter periplasmic adaptor subunit OqxA	core	AMR	AMR	PHENICOL/QUINOLONE	PHENICOL/QUINOLONE	EXACTP	391	391	100.00	100.00	391	WP_002914189.1	multidrug efflux RND transporter periplasmic adaptor subunit OqxA	NF000272.1	multidrug efflux RND transporter periplasmic adaptor subunit OqxA
ERR16718597	ERR16718597_00703	gnl|Bactopia|ERR16718597_2	31993	35145	+	oqxB	multidrug efflux RND transporter permease subunit OqxB	core	AMR	AMR	PHENICOL/QUINOLONE	PHENICOL/QUINOLONE	BLASTP	1050	1050	100.00	99.81	1050	WP_016947602.1	multidrug efflux RND transporter permease subunit OqxB25	NF000037.1	multidrug efflux RND transporter permease subunit OqxB
ERR16718597	ERR16718597_01034	gnl|Bactopia|ERR16718597_2	380847	381269	-	arsC	glutaredoxin-dependent arsenate reductase	plus	STRESS	METAL	ARSENIC	ARSENATE	HMM	140	141	98.58	79.14	139	AAA21096.1	glutaredoxin-dependent arsenate reductase	NF007456.1	glutaredoxin-dependent arsenate reductase
ERR16718597	ERR16718597_04312	gnl|Bactopia|ERR16718597_20	39723	40625	-	fieF	CDF family cation-efflux transporter FieF	plus	STRESS	METAL	NA	NA	EXACTP	300	300	100.00	100.00	300	BAB89353.1	CDF family cation-efflux transporter FieF	NA	NA
ERR16718597	ERR16718597_04916	gnl|Bactopia|ERR16718597_31	848	1282	-	pcoE	copper resistance system metallochaperone PcoE	plus	STRESS	METAL	COPPER	COPPER	BLASTP	144	144	100.00	94.44	144	CAA58532.1	copper resistance system metallochaperone PcoE	NA	NA
ERR16718597	ERR16718597_04917	gnl|Bactopia|ERR16718597_31	1499	2899	-	pcoS	copper resistance membrane spanning protein PcoS	plus	STRESS	METAL	COPPER	COPPER	BLASTP	466	466	100.00	99.14	466	CAA58530.1	copper resistance membrane spanning protein PcoS	NA	NA
ERR16718597	ERR16718597_04918	gnl|Bactopia|ERR16718597_31	2896	3576	-	pcoR	copper response regulator transcription factor PcoR	plus	STRESS	METAL	COPPER	COPPER	EXACTP	226	226	100.00	100.00	226	CAA58529.1	copper response regulator transcription factor PcoR	NA	NA
ERR16718597	ERR16718597_04919	gnl|Bactopia|ERR16718597_31	3631	4560	-	pcoD	copper resistance inner membrane protein PcoD	plus	STRESS	METAL	COPPER	COPPER	BLASTP	309	309	100.00	99.68	309	CAA58528.1	copper resistance inner membrane protein PcoD	NA	NA
ERR16718597	ERR16718597_04920	gnl|Bactopia|ERR16718597_31	4565	4945	-	pcoC	copper resistance system metallochaperone PcoC	plus	STRESS	METAL	COPPER	COPPER	EXACTP	126	126	100.00	100.00	126	CAA58527.1	copper resistance system metallochaperone PcoC	NA	NA
ERR16718597	ERR16718597_04921	gnl|Bactopia|ERR16718597_31	4985	5881	-	pcoB	copper-binding protein PcoB	plus	STRESS	METAL	COPPER	COPPER	BLASTP	298	296	100.00	100.00	296	CAA58526.1	copper-binding protein PcoB	NA	NA
ERR16718597	ERR16718597_04922	gnl|Bactopia|ERR16718597_31	5881	7698	-	pcoA	multicopper oxidase PcoA	plus	STRESS	METAL	COPPER	COPPER	EXACTP	605	605	100.00	100.00	605	CAA58525.1	multicopper oxidase PcoA	NA	NA
ERR16718597	ERR16718597_04926	gnl|Bactopia|ERR16718597_31	9679	12132	-	silP	Ag(+)-translocating P-type ATPase SilP	plus	STRESS	METAL	SILVER	SILVER	BLASTP	817	824	98.79	94.13	818	AAD11750.1	Ag(+)-translocating P-type ATPase SilP	NA	NA
ERR16718597	ERR16718597_04928	gnl|Bactopia|ERR16718597_31	12786	15932	-	silA	Cu(+)/Ag(+) efflux RND transporter permease subunit SilA	plus	STRESS	METAL	COPPER/SILVER	COPPER/SILVER	BLASTP	1048	1048	100.00	98.85	1048	AAD11749.1	Cu(+)/Ag(+) efflux RND transporter permease subunit SilA	NA	NA
ERR16718597	ERR16718597_04929	gnl|Bactopia|ERR16718597_31	15943	17235	-	silB	Cu(+)/Ag(+) efflux RND transporter periplasmic adaptor subunit SilB	plus	STRESS	METAL	COPPER/SILVER	COPPER/SILVER	BLASTP	430	430	100.00	97.91	430	AAD11748.1	Cu(+)/Ag(+) efflux RND transporter periplasmic adaptor subunit SilB	NA	NA
ERR16718597	ERR16718597_04930	gnl|Bactopia|ERR16718597_31	17349	17702	-	silF	Cu(+)/Ag(+) efflux RND transporter periplasmic metallochaperone SilF	plus	STRESS	METAL	COPPER/SILVER	COPPER/SILVER	BLASTP	117	117	100.00	99.15	117	KGL71342.1	Cu(+)/Ag(+) efflux RND transporter periplasmic metallochaperone SilF	NA	NA
ERR16718597	ERR16718597_04931	gnl|Bactopia|ERR16718597_31	17731	19116	-	silC	Cu(+)/Ag(+) efflux RND transporter outer membrane channel SilC	plus	STRESS	METAL	COPPER/SILVER	COPPER/SILVER	EXACTP	461	461	100.00	100.00	461	SPD96884.1	Cu(+)/Ag(+) efflux RND transporter outer membrane channel SilC	NA	NA
ERR16718597	ERR16718597_04932	gnl|Bactopia|ERR16718597_31	19306	19986	+	silR	copper/silver response regulator transcription factor SilR	plus	STRESS	METAL	COPPER/SILVER	COPPER/SILVER	EXACTP	226	226	100.00	100.00	226	SPD96883.1	copper/silver response regulator transcription factor SilR	NA	NA
ERR16718597	ERR16718597_04933	gnl|Bactopia|ERR16718597_31	19979	21454	+	silS	copper/silver sensor histidine kinase SilS	plus	STRESS	METAL	COPPER/SILVER	COPPER/SILVER	EXACTP	491	491	100.00	100.00	491	SPD96882.1	copper/silver sensor histidine kinase SilS	NA	NA
ERR16718597	ERR16718597_04934	gnl|Bactopia|ERR16718597_31	21705	22136	+	silE	silver-binding protein SilE	plus	STRESS	METAL	SILVER	SILVER	BLASTP	143	143	100.00	91.61	143	AAD11743.1	silver-binding protein SilE	NA	NA
ERR16718597	ERR16718597_05096	gnl|Bactopia|ERR16718597_37	2018	2383	-	ble	bleomycin binding protein Ble-MBL	core	AMR	AMR	BLEOMYCIN	BLEOMYCIN	EXACTP	121	121	100.00	100.00	121	WP_004201167.1	bleomycin binding protein Ble-MBL	NF012202.0	bleomycin binding protein Ble-MBL
ERR16718597	ERR16718597_05097	gnl|Bactopia|ERR16718597_37	2387	3199	-	blaNDM-1	subclass B1 metallo-beta-lactamase NDM-1	core	AMR	AMR	BETA-LACTAM	CARBAPENEM	ALLELEP	270	270	100.00	100.00	270	WP_004201164.1	subclass B1 metallo-beta-lactamase NDM-1	NF000259.2	NDM family subclass B1 metallo-beta-lactamase
ERR16718597	ERR16718597_05100	gnl|Bactopia|ERR16718597_37	5632	6411	-	aph(3')-VI	APH(3')-VI family aminoglycoside O-phosphotransferase	core	AMR	AMR	AMINOGLYCOSIDE	AMIKACIN/KANAMYCIN	EXACTP	259	259	100.00	100.00	259	WP_014386410.1	APH(3')-VI family aminoglycoside O-phosphotransferase	NF033062.0	APH(3')-VI family aminoglycoside O-phosphotransferase
ERR16718597	ERR16718597_05104	gnl|Bactopia|ERR16718597_37	10289	10945	-	qnrS1	quinolone resistance pentapeptide repeat protein QnrS1	core	AMR	AMR	QUINOLONE	QUINOLONE	ALLELEP	218	218	100.00	100.00	218	WP_001516695.1	quinolone resistance pentapeptide repeat protein QnrS1	NF000056.3	QnrS family quinolone resistance pentapeptide repeat protein
ERR16718597	ERR16718597_05110	gnl|Bactopia|ERR16718597_37	15586	16461	-	blaCTX-M-15	extended-spectrum class A beta-lactamase CTX-M-15	core	AMR	AMR	BETA-LACTAM	CEPHALOSPORIN	ALLELEP	291	291	100.00	100.00	291	WP_000239590.1	extended-spectrum class A beta-lactamase CTX-M-15	NF033089.1	CTX-M family extended-spectrum class A beta-lactamase
ERR16718597	ERR16718597_05134	gnl|Bactopia|ERR16718597_39	7195	7620	-	arsC	glutaredoxin-dependent arsenate reductase	plus	STRESS	METAL	ARSENIC	ARSENATE	EXACTP	141	141	100.00	100.00	141	BAA24824.1	glutaredoxin-dependent arsenate reductase	NF007456.1	glutaredoxin-dependent arsenate reductase
ERR16718597	ERR16718597_05135	gnl|Bactopia|ERR16718597_39	7633	8922	-	arsB	arsenite efflux transporter membrane subunit ArsB	plus	STRESS	METAL	ARSENIC	ARSENITE	EXACTP	429	429	100.00	100.00	429	BAA24823.1	arsenite efflux transporter membrane subunit ArsB	NA	NA
ERR16718597	ERR16718597_05136	gnl|Bactopia|ERR16718597_39	8970	10721	-	arsA	arsenite efflux transporter ATPase subunit ArsA	plus	STRESS	METAL	ARSENIC	ARSENITE	EXACTP	583	583	100.00	100.00	583	BAA24822.1	arsenite efflux transporter ATPase subunit ArsA	NA	NA
ERR16718597	ERR16718597_05137	gnl|Bactopia|ERR16718597_39	10739	11101	-	arsD	arsenite efflux transporter metallochaperone ArsD	plus	STRESS	METAL	ARSENIC	ARSENITE	BLASTP	120	120	100.00	91.67	120	AAB09625.1	arsenite efflux transporter metallochaperone ArsD	NF033727.2	arsenite efflux transporter metallochaperone ArsD
ERR16718597	ERR16718597_05138	gnl|Bactopia|ERR16718597_39	11151	11501	-	arsR	As(III)-sensing metalloregulatory transcriptional repressor ArsR	plus	STRESS	METAL	ARSENIC	ARSENIC	EXACTP	116	116	100.00	100.00	116	AET17094.1	As(III)-sensing metalloregulatory transcriptional repressor ArsR	NA	NA
ERR16718597	ERR16718597_05184	gnl|Bactopia|ERR16718597_43	10102	10962	-	blaTEM-1	broad-spectrum class A beta-lactamase TEM-1	core	AMR	AMR	BETA-LACTAM	BETA-LACTAM	ALLELEP	286	286	100.00	100.00	286	WP_000027057.1	broad-spectrum class A beta-lactamase TEM-1	NF000531.2	TEM family class A beta-lactamase
ERR16718597	ERR16718597_05232	gnl|Bactopia|ERR16718597_48	4437	5276	-	sul1	sulfonamide-resistant dihydropteroate synthase Sul1	core	AMR	AMR	SULFONAMIDE	SULFONAMIDE	EXACTP	279	279	100.00	100.00	279	WP_000259031.1	sulfonamide-resistant dihydropteroate synthase Sul1	NF000294.1	sulfonamide-resistant dihydropteroate synthase Sul1
ERR16718597	ERR16718597_05233	gnl|Bactopia|ERR16718597_48	5270	5617	-	qacEdelta1	quaternary ammonium compound efflux SMR transporter QacE delta 1	core	STRESS	BIOCIDE	QUATERNARY AMMONIUM	QUATERNARY AMMONIUM	ALLELEP	115	115	100.00	100.00	115	WP_000679427.1	quaternary ammonium compound efflux SMR transporter QacE delta 1	NF000276.2	quaternary ammonium compound efflux SMR transporter QacE
ERR16718597	ERR16718597_05234	gnl|Bactopia|ERR16718597_48	5840	6292	-	arr-3	NAD(+)--rifampin ADP-ribosyltransferase Arr-3	core	AMR	AMR	RIFAMYCIN	RIFAMYCIN	EXACTP	150	150	100.00	100.00	150	WP_001749986.1	NAD(+)--rifampin ADP-ribosyltransferase Arr-3	NF033144.1	NAD(+)--rifampin ADP-ribosyltransferase
ERR16718597	ERR16718597_05235	gnl|Bactopia|ERR16718597_48	6377	7009	-	catB3	type B-3 chloramphenicol O-acetyltransferase CatB3	core	AMR	AMR	PHENICOL	CHLORAMPHENICOL	EXACTP	210	210	100.00	100.00	210	WP_000186237.1	type B-3 chloramphenicol O-acetyltransferase CatB3	NF000490.1	type B chloramphenicol O-acetyltransferase
ERR16718597	ERR16718597_05236	gnl|Bactopia|ERR16718597_48	7147	7977	-	blaOXA-1	oxacillin-hydrolyzing class D beta-lactamase OXA-1	core	AMR	AMR	BETA-LACTAM	CEPHALOSPORIN	ALLELEP	276	276	100.00	100.00	276	WP_001334766.1	oxacillin-hydrolyzing class D beta-lactamase OXA-1	NF000388.2	OXA-1 family class D beta-lactamase
ERR16718597	ERR16718597_05237	gnl|Bactopia|ERR16718597_48	8108	8626	-	aac(6')-Ib-cr	fluoroquinolone-acetylating aminoglycoside 6'-N-acetyltransferase AAC(6')-Ib-cr	core	AMR	AMR	AMINOGLYCOSIDE/QUINOLONE	AMIKACIN/KANAMYCIN/QUINOLONE/TOBRAMYCIN	BLASTP	172	184	93.48	100.00	172	WP_063840321.1	fluoroquinolone-acetylating aminoglycoside 6'-N-acetyltransferase AAC(6')-Ib-cr5	NF033074.0	AAC(6')-Ib family aminoglycoside 6'-N-acetyltransferase
ERR16718597	ERR16718597_01873	gnl|Bactopia|ERR16718597_5	190164	191966	-	ybtQ	yersiniabactin ABC transporter ATP-binding/permease protein YbtQ	plus	VIRULENCE	VIRULENCE	NA	NA	BLASTP	600	600	100.00	99.83	600	AAC69584.1	yersiniabactin ABC transporter ATP-binding/permease protein YbtQ	NA	NA
ERR16718597	ERR16718597_01874	gnl|Bactopia|ERR16718597_5	191953	193665	-	ybtP	yersiniabactin ABC transporter ATP-binding/permease protein YbtP	plus	VIRULENCE	VIRULENCE	NA	NA	BLASTP	570	600	95.00	99.82	570	CAA21388.1	yersiniabactin ABC transporter ATP-binding/permease protein YbtP	NA	NA
ERR16718597	NA	gnl|Bactopia|ERR16718597_60	3	293	+	aac(6')-Ib	AAC(6')-Ib family aminoglycoside 6'-N-acetyltransferase	core	AMR	AMR	AMINOGLYCOSIDE	AMIKACIN/KANAMYCIN/TOBRAMYCIN	PARTIAL_CONTIG_ENDX	97	184	52.72	100.00	97	WP_063840280.1	AAC(6')-Ib family aminoglycoside 6'-N-acetyltransferase	NA	NA
ERR16718597	NA	gnl|Bactopia|ERR16718597_60	366	1151	+	aadA1	ANT(3'')-Ia family aminoglycoside nucleotidyltransferase AadA1	core	AMR	AMR	AMINOGLYCOSIDE	STREPTOMYCIN	EXACTX	262	262	100.00	100.00	262	WP_001206315.1	ANT(3'')-Ia family aminoglycoside nucleotidyltransferase AadA1	NF033126.1	ANT(3'')-Ia family aminoglycoside nucleotidyltransferase AadA1
ERR16718597	ERR16718597_05282	gnl|Bactopia|ERR16718597_60	1214	2038	+	blaOXA-9	oxacillin-hydrolyzing class D beta-lactamase OXA-9	core	AMR	AMR	BETA-LACTAM	BETA-LACTAM	ALLELEP	274	274	100.00	100.00	274	WP_000722315.1	oxacillin-hydrolyzing class D beta-lactamase OXA-9	NF040532.1	OXA-9 family oxacillin-hydrolyzing class D beta-lactamase
ERR16718597	NA	gnl|Bactopia|ERR16718597_62	53	841	-	aadA2	ANT(3'')-Ia family aminoglycoside nucleotidyltransferase AadA2	core	AMR	AMR	AMINOGLYCOSIDE	STREPTOMYCIN	EXACTX	263	263	100.00	100.00	263	WP_001206356.1	ANT(3'')-Ia family aminoglycoside nucleotidyltransferase AadA2	NF012157.0	ANT(3'')-I family aminoglycoside nucleotidyltransferase
ERR16718597	ERR16718597_05285	gnl|Bactopia|ERR16718597_62	1249	1746	-	dfrA12	trimethoprim-resistant dihydrofolate reductase DfrA12	core	AMR	AMR	TRIMETHOPRIM	TRIMETHOPRIM	EXACTP	165	165	100.00	100.00	165	WP_001083725.1	trimethoprim-resistant dihydrofolate reductase DfrA12	NF000053.2	trimethoprim-resistant dihydrofolate reductase DfrA12
ERR16718597	ERR16718597_05287	gnl|Bactopia|ERR16718597_64	91	732	-	catA2	type A-2 chloramphenicol O-acetyltransferase CatII	core	AMR	AMR	PHENICOL	CHLORAMPHENICOL	EXACTP	213	213	100.00	100.00	213	WP_001011939.1	type A-2 chloramphenicol O-acetyltransferase CatII	NF000491.1	type A chloramphenicol O-acetyltransferase
ERR16718618	ERR16718618_02749	gnl|Bactopia|ERR16718618_13	28695	29870	+	oqxA	multidrug efflux RND transporter periplasmic adaptor subunit OqxA	core	AMR	AMR	PHENICOL/QUINOLONE	PHENICOL/QUINOLONE	EXACTP	391	391	100.00	100.00	391	WP_002914189.1	multidrug efflux RND transporter periplasmic adaptor subunit OqxA	NF000272.1	multidrug efflux RND transporter periplasmic adaptor subunit OqxA
ERR16718618	ERR16718618_02750	gnl|Bactopia|ERR16718618_13	29894	33046	+	oqxB	multidrug efflux RND transporter permease subunit OqxB	core	AMR	AMR	PHENICOL/QUINOLONE	PHENICOL/QUINOLONE	BLASTP	1050	1050	100.00	99.90	1050	WP_021312368.1	multidrug efflux RND transporter permease subunit OqxB20	NF000037.1	multidrug efflux RND transporter permease subunit OqxB
ERR16718618	ERR16718618_03284	gnl|Bactopia|ERR16718618_16	119104	119964	+	blaSHV-28	broad-spectrum class A beta-lactamase SHV-28	core	AMR	AMR	BETA-LACTAM	BETA-LACTAM	ALLELEP	286	286	100.00	100.00	286	WP_004179754.1	broad-spectrum class A beta-lactamase SHV-28	NF000285.3	SHV family class A beta-lactamase
ERR16718618	ERR16718618_03703	gnl|Bactopia|ERR16718618_20	79745	80929	-	emrD	multidrug efflux MFS transporter EmrD	plus	AMR	AMR	EFFLUX	EFFLUX	BLASTP	394	394	100.00	99.49	394	ACN65732.1	multidrug efflux MFS transporter EmrD	NA	NA
ERR16718618	ERR16718618_03864	gnl|Bactopia|ERR16718618_22	53434	54336	+	fieF	CDF family cation-efflux transporter FieF	plus	STRESS	METAL	NA	NA	EXACTP	300	300	100.00	100.00	300	BAB89353.1	CDF family cation-efflux transporter FieF	NA	NA
ERR16718618	ERR16718618_04079	gnl|Bactopia|ERR16718618_25	9008	9586	-	terD	tellurium resistance membrane protein TerD	plus	STRESS	METAL	TELLURIUM	TELLURIUM	BLASTP	192	192	100.00	95.83	192	AAA98292.1	tellurium resistance membrane protein TerD	NA	NA
ERR16718618	ERR16718618_04083	gnl|Bactopia|ERR16718618_25	12333	12914	-	terZ	tellurium resistance-associated protein TerZ	plus	STRESS	METAL	TELLURIUM	TELLURIUM	BLASTP	193	193	100.00	96.37	193	AAA86846.1	tellurium resistance-associated protein TerZ	NA	NA
