Name	Protein id	Contig id	Start	Stop	Strand	Element symbol	Element name	Scope	Type	Subtype	Class	Subclass	Method	Target length	Reference sequence length	% Coverage of reference	% Identity to reference	Alignment length	Closest reference accession	Closest reference name	HMM accession	HMM description
ERR16718618	ERR16718618_04090	gnl|Bactopia|ERR16718618_25	19487	19954	+	terW	tellurium resistance protein TerW	plus	STRESS	METAL	TELLURIUM	TELLURIUM	EXACTP	155	155	100.00	100.00	155	AAC44736.1	tellurium resistance protein TerW	NA	NA
ERR16718618	ERR16718618_00816	gnl|Bactopia|ERR16718618_3	208301	209533	-	kdeA	multidrug efflux MFS transporter KdeA	plus	AMR	AMR	EFFLUX	EFFLUX	EXACTP	410	410	100.00	100.00	410	ABR76310.1	multidrug efflux MFS transporter KdeA	NA	NA
ERR16718618	ERR16718618_04493	gnl|Bactopia|ERR16718618_30	23058	23489	-	silE	silver-binding protein SilE	plus	STRESS	METAL	SILVER	SILVER	BLASTP	143	143	100.00	92.31	143	AAD11743.1	silver-binding protein SilE	NA	NA
ERR16718618	ERR16718618_04494	gnl|Bactopia|ERR16718618_30	23740	25215	-	silS	copper/silver sensor histidine kinase SilS	plus	STRESS	METAL	COPPER/SILVER	COPPER/SILVER	BLASTP	491	491	100.00	98.98	491	SPD96882.1	copper/silver sensor histidine kinase SilS	NA	NA
ERR16718618	ERR16718618_04495	gnl|Bactopia|ERR16718618_30	25208	25888	-	silR	copper/silver response regulator transcription factor SilR	plus	STRESS	METAL	COPPER/SILVER	COPPER/SILVER	BLASTP	226	226	100.00	98.23	226	SPD96883.1	copper/silver response regulator transcription factor SilR	NA	NA
ERR16718618	ERR16718618_04496	gnl|Bactopia|ERR16718618_30	26078	27463	+	silC	Cu(+)/Ag(+) efflux RND transporter outer membrane channel SilC	plus	STRESS	METAL	COPPER/SILVER	COPPER/SILVER	BLASTP	461	461	100.00	99.57	461	SPD96884.1	Cu(+)/Ag(+) efflux RND transporter outer membrane channel SilC	NA	NA
ERR16718618	ERR16718618_04497	gnl|Bactopia|ERR16718618_30	27492	27845	+	silF	Cu(+)/Ag(+) efflux RND transporter periplasmic metallochaperone SilF	plus	STRESS	METAL	COPPER/SILVER	COPPER/SILVER	BLASTP	117	117	100.00	99.15	117	KGL71342.1	Cu(+)/Ag(+) efflux RND transporter periplasmic metallochaperone SilF	NA	NA
ERR16718618	ERR16718618_04498	gnl|Bactopia|ERR16718618_30	27959	29251	+	silB	Cu(+)/Ag(+) efflux RND transporter periplasmic adaptor subunit SilB	plus	STRESS	METAL	COPPER/SILVER	COPPER/SILVER	BLASTP	430	430	100.00	97.91	430	AAD11748.1	Cu(+)/Ag(+) efflux RND transporter periplasmic adaptor subunit SilB	NA	NA
ERR16718618	ERR16718618_04499	gnl|Bactopia|ERR16718618_30	29262	32408	+	silA	Cu(+)/Ag(+) efflux RND transporter permease subunit SilA	plus	STRESS	METAL	COPPER/SILVER	COPPER/SILVER	BLASTP	1048	1048	100.00	98.76	1048	AAD11749.1	Cu(+)/Ag(+) efflux RND transporter permease subunit SilA	NA	NA
ERR16718618	ERR16718618_04501	gnl|Bactopia|ERR16718618_30	33062	35509	+	silP	Ag(+)-translocating P-type ATPase SilP	plus	STRESS	METAL	SILVER	SILVER	BLASTP	815	824	98.79	94.49	816	AAD11750.1	Ag(+)-translocating P-type ATPase SilP	NA	NA
ERR16718618	ERR16718618_04505	gnl|Bactopia|ERR16718618_30	37490	39307	+	pcoA	multicopper oxidase PcoA	plus	STRESS	METAL	COPPER	COPPER	BLASTP	605	605	100.00	99.83	605	CAA58525.1	multicopper oxidase PcoA	NA	NA
ERR16718618	ERR16718618_04506	gnl|Bactopia|ERR16718618_30	39307	40203	+	pcoB	copper-binding protein PcoB	plus	STRESS	METAL	COPPER	COPPER	BLASTP	298	296	100.00	100.00	296	CAA58526.1	copper-binding protein PcoB	NA	NA
ERR16718618	ERR16718618_04507	gnl|Bactopia|ERR16718618_30	40243	40623	+	pcoC	copper resistance system metallochaperone PcoC	plus	STRESS	METAL	COPPER	COPPER	EXACTP	126	126	100.00	100.00	126	CAA58527.1	copper resistance system metallochaperone PcoC	NA	NA
ERR16718618	ERR16718618_04508	gnl|Bactopia|ERR16718618_30	40628	41557	+	pcoD	copper resistance inner membrane protein PcoD	plus	STRESS	METAL	COPPER	COPPER	BLASTP	309	309	100.00	99.68	309	CAA58528.1	copper resistance inner membrane protein PcoD	NA	NA
ERR16718618	ERR16718618_04509	gnl|Bactopia|ERR16718618_30	41612	42292	+	pcoR	copper response regulator transcription factor PcoR	plus	STRESS	METAL	COPPER	COPPER	EXACTP	226	226	100.00	100.00	226	CAA58529.1	copper response regulator transcription factor PcoR	NA	NA
ERR16718618	ERR16718618_04510	gnl|Bactopia|ERR16718618_30	42289	43689	+	pcoS	copper resistance membrane spanning protein PcoS	plus	STRESS	METAL	COPPER	COPPER	BLASTP	466	466	100.00	99.36	466	CAA58530.1	copper resistance membrane spanning protein PcoS	NA	NA
ERR16718618	ERR16718618_04511	gnl|Bactopia|ERR16718618_30	43907	44341	+	pcoE	copper resistance system metallochaperone PcoE	plus	STRESS	METAL	COPPER	COPPER	BLASTP	144	144	100.00	97.92	144	CAA58532.1	copper resistance system metallochaperone PcoE	NA	NA
ERR16718618	ERR16718618_04525	gnl|Bactopia|ERR16718618_30	53434	53859	-	arsC	glutaredoxin-dependent arsenate reductase	plus	STRESS	METAL	ARSENIC	ARSENATE	BLASTP	141	141	100.00	99.29	141	BAA24824.1	glutaredoxin-dependent arsenate reductase	NF007456.1	glutaredoxin-dependent arsenate reductase
ERR16718618	ERR16718618_04526	gnl|Bactopia|ERR16718618_30	53872	55161	-	arsB	arsenite efflux transporter membrane subunit ArsB	plus	STRESS	METAL	ARSENIC	ARSENITE	BLASTP	429	429	100.00	98.83	429	BAA24823.1	arsenite efflux transporter membrane subunit ArsB	NA	NA
ERR16718618	ERR16718618_04527	gnl|Bactopia|ERR16718618_30	55209	56960	-	arsA	arsenite efflux transporter ATPase subunit ArsA	plus	STRESS	METAL	ARSENIC	ARSENITE	BLASTP	583	583	100.00	98.80	583	BAA24822.1	arsenite efflux transporter ATPase subunit ArsA	NA	NA
ERR16718618	ERR16718618_04528	gnl|Bactopia|ERR16718618_30	56978	57340	-	arsD	arsenite efflux transporter metallochaperone ArsD	plus	STRESS	METAL	ARSENIC	ARSENITE	BLASTP	120	120	100.00	90.83	120	AAB09625.1	arsenite efflux transporter metallochaperone ArsD	NF033727.2	arsenite efflux transporter metallochaperone ArsD
ERR16718618	ERR16718618_04529	gnl|Bactopia|ERR16718618_30	57392	57742	-	arsR	As(III)-sensing metalloregulatory transcriptional repressor ArsR	plus	STRESS	METAL	ARSENIC	ARSENIC	BLASTP	116	116	100.00	98.28	116	AET17094.1	As(III)-sensing metalloregulatory transcriptional repressor ArsR	NA	NA
ERR16718618	ERR16718618_04566	gnl|Bactopia|ERR16718618_31	25655	25891	-	asr	acid resistance repetitive basic protein Asr	plus	STRESS	ACID	NA	NA	HMM	78	102	100.00	52.94	102	BAA15331.2	acid resistance repetitive basic protein Asr	NF033636.1	acid resistance repetitive basic protein Asr
ERR16718618	ERR16718618_04992	gnl|Bactopia|ERR16718618_39	41796	43094	+	ncrA	nickel resistance membrane nickel efflux protein NcrA	plus	STRESS	METAL	NICKEL	NICKEL	EXACTP	432	432	100.00	100.00	432	ABF61434.1	nickel resistance membrane nickel efflux protein NcrA	NA	NA
ERR16718618	ERR16718618_04993	gnl|Bactopia|ERR16718618_39	43200	43469	+	ncrB	nickel-sensing transcriptional repressor NcrB	plus	STRESS	METAL	NICKEL	NICKEL	EXACTP	89	89	100.00	100.00	89	ABF61435.1	nickel-sensing transcriptional repressor NcrB	NA	NA
ERR16718618	ERR16718618_04994	gnl|Bactopia|ERR16718618_39	43482	44612	+	ncrC	Ni(II)/Co(II) efflux transporter permease subunit NcrC	plus	STRESS	METAL	COPPER/NICKEL	COPPER/NICKEL	EXACTP	376	376	100.00	100.00	376	ADF64798.1	Ni(II)/Co(II) efflux transporter permease subunit NcrC	NA	NA
ERR16718618	NA	gnl|Bactopia|ERR16718618_39	44774	45193	+	ncrY	nickel resistance OB fold protein NcrY	plus	STRESS	METAL	NICKEL	NICKEL	EXACTX	140	140	100.00	100.00	140	ABF61437.1	nickel resistance OB fold protein NcrY	NA	NA
ERR16718618	ERR16718618_05318	gnl|Bactopia|ERR16718618_49	11073	11648	-	terE	tellurium resistance cAMP binding protein TerE	plus	STRESS	METAL	TELLURIUM	TELLURIUM	BLASTP	191	191	100.00	99.48	191	AAA98293.1	tellurium resistance cAMP binding protein TerE	NA	NA
ERR16718618	ERR16718618_05319	gnl|Bactopia|ERR16718618_49	11735	12313	-	terD	tellurium resistance membrane protein TerD	plus	STRESS	METAL	TELLURIUM	TELLURIUM	BLASTP	192	192	100.00	98.96	192	AAA98292.1	tellurium resistance membrane protein TerD	NA	NA
ERR16718618	ERR16718618_05320	gnl|Bactopia|ERR16718618_49	12352	13392	-	terC	tellurium resistance membrane protein TerC	plus	STRESS	METAL	TELLURIUM	TELLURIUM	BLASTP	346	346	100.00	99.13	346	AAA98291.1	tellurium resistance membrane protein TerC	NA	NA
ERR16718618	ERR16718618_05321	gnl|Bactopia|ERR16718618_49	13416	13871	-	terB	tellurium resistance membrane protein TerB	plus	STRESS	METAL	TELLURIUM	TELLURIUM	EXACTP	151	151	100.00	100.00	151	ACI12150.1	tellurium resistance membrane protein TerB	NA	NA
ERR16718618	ERR16718618_05322	gnl|Bactopia|ERR16718618_49	13894	15045	-	terA	tellurium resistance system protein TerA	plus	STRESS	METAL	NA	NA	BLASTP	383	383	100.00	99.48	383	AHE47495.1	tellurium resistance system protein TerA	NA	NA
ERR16718618	ERR16718618_01424	gnl|Bactopia|ERR16718618_5	247969	248388	-	fosA	FosA5 family fosfomycin resistance glutathione transferase	core	AMR	AMR	FOSFOMYCIN	FOSFOMYCIN	EXACTP	139	139	100.00	100.00	139	WP_004146118.1	FosA5 family fosfomycin resistance glutathione transferase	NF040540.1	FosA5 family fosfomycin resistance glutathione transferase
ERR16718618	ERR16718618_05412	gnl|Bactopia|ERR16718618_54	10927	11352	-	arsC	glutaredoxin-dependent arsenate reductase	plus	STRESS	METAL	ARSENIC	ARSENATE	BLASTP	141	141	99.29	90.00	140	AAA21096.1	glutaredoxin-dependent arsenate reductase	NF007456.1	glutaredoxin-dependent arsenate reductase
ERR16718618	ERR16718618_05417	gnl|Bactopia|ERR16718618_55	84	1406	-	merA	mercury(II) reductase	plus	STRESS	METAL	MERCURY	MERCURY	PARTIALP	440	561	77.90	91.53	437	ACU65296.1	mercury(II) reductase	NA	NA
ERR16718618	ERR16718618_05418	gnl|Bactopia|ERR16718618_55	1445	1870	-	merC	organomercurial transporter MerC	plus	STRESS	METAL	MERCURY	ORGANOMERCURY	HMM	141	141	100.00	80.14	141	AAC38233.1	organomercurial transporter MerC	NF033784.1	organomercurial transporter MerC
ERR16718618	ERR16718618_05419	gnl|Bactopia|ERR16718618_55	1898	2173	-	merP	mercury resistance system periplasmic binding protein MerP	plus	STRESS	METAL	MERCURY	MERCURY	HMM	91	91	100.00	85.71	91	AAC38219.1	mercury resistance system periplasmic binding protein MerP	TIGR02052.1	mercury resistance system periplasmic binding protein MerP
ERR16718618	ERR16718618_05420	gnl|Bactopia|ERR16718618_55	2189	2554	-	merT	mercuric transport protein MerT	plus	STRESS	METAL	MERCURY	MERCURY	BLASTP	121	116	99.14	98.26	115	CAA70196.1	mercuric transport protein MerT	NA	NA
ERR16718618	ERR16718618_05421	gnl|Bactopia|ERR16718618_55	2626	3081	+	merR	mercury resistance transcriptional regulator MerR	plus	STRESS	METAL	MERCURY	MERCURY	BLASTP	151	144	98.61	92.96	142	CAA77320.1	mercury resistance transcriptional regulator MerR	NF010315.0	mercury resistance transcriptional regulator MerR
ERR16718618	ERR16718618_05460	gnl|Bactopia|ERR16718618_58	221	880	+	catA1	type A-1 chloramphenicol O-acetyltransferase	core	AMR	AMR	PHENICOL	CHLORAMPHENICOL	EXACTP	219	219	100.00	100.00	219	WP_000412211.1	type A-1 chloramphenicol O-acetyltransferase	NF000491.1	type A chloramphenicol O-acetyltransferase
ERR16718618	ERR16718618_01598	gnl|Bactopia|ERR16718618_6	172733	173155	-	arsC	glutaredoxin-dependent arsenate reductase	plus	STRESS	METAL	ARSENIC	ARSENATE	HMM	140	141	98.58	78.42	139	AAA21096.1	glutaredoxin-dependent arsenate reductase	NF007456.1	glutaredoxin-dependent arsenate reductase
ERR16718618	ERR16718618_05498	gnl|Bactopia|ERR16718618_63	5073	5867	-	blaOXA-917	OXA-427 family carbapenem-hydrolyzing class D beta-lactamase OXA-917	core	AMR	AMR	BETA-LACTAM	CARBAPENEM	ALLELEP	264	264	100.00	100.00	264	WP_161507793.1	OXA-427 family carbapenem-hydrolyzing class D beta-lactamase OXA-917	NF038217.2	OXA-427 family carbapenem-hydrolyzing class D beta-lactamase
ERR16718618	ERR16718618_05512	gnl|Bactopia|ERR16718618_66	2679	3554	+	blaCTX-M-15	extended-spectrum class A beta-lactamase CTX-M-15	core	AMR	AMR	BETA-LACTAM	CEPHALOSPORIN	ALLELEP	291	291	100.00	100.00	291	WP_000239590.1	extended-spectrum class A beta-lactamase CTX-M-15	NF033089.1	CTX-M family extended-spectrum class A beta-lactamase
ERR16718618	ERR16718618_05534	gnl|Bactopia|ERR16718618_71	146	1006	+	blaTEM-1	broad-spectrum class A beta-lactamase TEM-1	core	AMR	AMR	BETA-LACTAM	BETA-LACTAM	ALLELEP	286	286	100.00	100.00	286	WP_000027057.1	broad-spectrum class A beta-lactamase TEM-1	NF000531.2	TEM family class A beta-lactamase
ERR16718618	ERR16718618_05536	gnl|Bactopia|ERR16718618_71	1486	2670	-	tet(D)	tetracycline efflux MFS transporter Tet(D)	core	AMR	AMR	TETRACYCLINE	TETRACYCLINE	EXACTP	394	394	100.00	100.00	394	WP_001039466.1	tetracycline efflux MFS transporter Tet(D)	NF012186.0	tetracycline efflux MFS transporter Tet(D)
ERR16718618	ERR16718618_05538	gnl|Bactopia|ERR16718618_72	1492	2289	-	blaOXA-48	OXA-48 family carbapenem-hydrolyzing class D beta-lactamase OXA-48	core	AMR	AMR	BETA-LACTAM	CARBAPENEM	ALLELEP	265	265	100.00	100.00	265	WP_015059991.1	OXA-48 family carbapenem-hydrolyzing class D beta-lactamase OXA-48	NF000387.2	OXA-48 family class D beta-lactamase
ERR16718618	NA	gnl|Bactopia|ERR16718618_76	3	776	-	sul1	sulfonamide-resistant dihydropteroate synthase Sul1	core	AMR	AMR	SULFONAMIDE	SULFONAMIDE	BLASTX	258	279	92.47	100.00	258	WP_000259031.1	sulfonamide-resistant dihydropteroate synthase Sul1	NA	NA
ERR16718618	ERR16718618_05546	gnl|Bactopia|ERR16718618_76	770	1117	-	qacEdelta1	quaternary ammonium compound efflux SMR transporter QacE delta 1	core	STRESS	BIOCIDE	QUATERNARY AMMONIUM	QUATERNARY AMMONIUM	ALLELEP	115	115	100.00	100.00	115	WP_000679427.1	quaternary ammonium compound efflux SMR transporter QacE delta 1	NF000276.2	quaternary ammonium compound efflux SMR transporter QacE
ERR16718618	ERR16718618_05547	gnl|Bactopia|ERR16718618_76	1274	1921	-	ant(2'')-Ia	aminoglycoside nucleotidyltransferase ANT(2'')-Ia	core	AMR	AMR	AMINOGLYCOSIDE	GENTAMICIN/KANAMYCIN/TOBRAMYCIN	BLASTP	215	177	100.00	100.00	177	WP_000381802.1	aminoglycoside nucleotidyltransferase ANT(2'')-Ia	NF000064.3	aminoglycoside nucleotidyltransferase ANT(2'')-Ia
ERR16718618	ERR16718618_05566	gnl|Bactopia|ERR16718618_89	74	547	-	dfrA25	trimethoprim-resistant dihydrofolate reductase DfrA25	core	AMR	AMR	TRIMETHOPRIM	TRIMETHOPRIM	EXACTP	157	157	100.00	100.00	157	WP_029391998.1	trimethoprim-resistant dihydrofolate reductase DfrA25	NF000330.1	trimethoprim-resistant dihydrofolate reductase DfrA
ERR16718619	ERR16718619_05421	gnl|Bactopia|ERR16718619_109	221	880	+	catA1	type A-1 chloramphenicol O-acetyltransferase	core	AMR	AMR	PHENICOL	CHLORAMPHENICOL	EXACTP	219	219	100.00	100.00	219	WP_000412211.1	type A-1 chloramphenicol O-acetyltransferase	NF000491.1	type A chloramphenicol O-acetyltransferase
ERR16718619	ERR16718619_05525	gnl|Bactopia|ERR16718619_123	5073	5867	-	blaOXA-917	OXA-427 family carbapenem-hydrolyzing class D beta-lactamase OXA-917	core	AMR	AMR	BETA-LACTAM	CARBAPENEM	ALLELEP	264	264	100.00	100.00	264	WP_161507793.1	OXA-427 family carbapenem-hydrolyzing class D beta-lactamase OXA-917	NF038217.2	OXA-427 family carbapenem-hydrolyzing class D beta-lactamase
ERR16718619	ERR16718619_01704	gnl|Bactopia|ERR16718619_13	86975	87394	-	fosA	FosA5 family fosfomycin resistance glutathione transferase	core	AMR	AMR	FOSFOMYCIN	FOSFOMYCIN	EXACTP	139	139	100.00	100.00	139	WP_004146118.1	FosA5 family fosfomycin resistance glutathione transferase	NF040540.1	FosA5 family fosfomycin resistance glutathione transferase
ERR16718619	ERR16718619_05565	gnl|Bactopia|ERR16718619_132	2679	3554	+	blaCTX-M-15	extended-spectrum class A beta-lactamase CTX-M-15	core	AMR	AMR	BETA-LACTAM	CEPHALOSPORIN	ALLELEP	291	291	100.00	100.00	291	WP_000239590.1	extended-spectrum class A beta-lactamase CTX-M-15	NF033089.1	CTX-M family extended-spectrum class A beta-lactamase
ERR16718619	ERR16718619_05647	gnl|Bactopia|ERR16718619_153	836	1441	+	aac(6')-Ib	AAC(6')-Ib family aminoglycoside 6'-N-acetyltransferase	core	AMR	AMR	AMINOGLYCOSIDE	AMIKACIN/KANAMYCIN/TOBRAMYCIN	BLASTP	201	184	100.00	100.00	184	WP_063840280.1	AAC(6')-Ib family aminoglycoside 6'-N-acetyltransferase	NF033074.0	AAC(6')-Ib family aminoglycoside 6'-N-acetyltransferase
ERR16718619	NA	gnl|Bactopia|ERR16718619_153	1511	2296	+	aadA1	ANT(3'')-Ia family aminoglycoside nucleotidyltransferase AadA1	core	AMR	AMR	AMINOGLYCOSIDE	STREPTOMYCIN	EXACTX	262	262	100.00	100.00	262	WP_001206315.1	ANT(3'')-Ia family aminoglycoside nucleotidyltransferase AadA1	NF033126.1	ANT(3'')-Ia family aminoglycoside nucleotidyltransferase AadA1
ERR16718619	ERR16718619_05649	gnl|Bactopia|ERR16718619_153	2359	3183	+	blaOXA-9	oxacillin-hydrolyzing class D beta-lactamase OXA-9	core	AMR	AMR	BETA-LACTAM	BETA-LACTAM	ALLELEP	274	274	100.00	100.00	274	WP_000722315.1	oxacillin-hydrolyzing class D beta-lactamase OXA-9	NF040532.1	OXA-9 family oxacillin-hydrolyzing class D beta-lactamase
ERR16718619	ERR16718619_05665	gnl|Bactopia|ERR16718619_157	1	861	+	blaTEM-1	broad-spectrum class A beta-lactamase TEM-1	core	AMR	AMR	BETA-LACTAM	BETA-LACTAM	ALLELEP	286	286	100.00	100.00	286	WP_000027057.1	broad-spectrum class A beta-lactamase TEM-1	NF000531.2	TEM family class A beta-lactamase
ERR16718619	ERR16718619_05667	gnl|Bactopia|ERR16718619_157	1341	2525	-	tet(D)	tetracycline efflux MFS transporter Tet(D)	core	AMR	AMR	TETRACYCLINE	TETRACYCLINE	EXACTP	394	394	100.00	100.00	394	WP_001039466.1	tetracycline efflux MFS transporter Tet(D)	NF012186.0	tetracycline efflux MFS transporter Tet(D)
ERR16718619	ERR16718619_05670	gnl|Bactopia|ERR16718619_159	594	2396	+	ybtQ	yersiniabactin ABC transporter ATP-binding/permease protein YbtQ	plus	VIRULENCE	VIRULENCE	NA	NA	BLASTP	600	600	100.00	99.83	600	AAC69584.1	yersiniabactin ABC transporter ATP-binding/permease protein YbtQ	NA	NA
ERR16718619	ERR16718619_05675	gnl|Bactopia|ERR16718619_161	4	660	-	qnrS1	quinolone resistance pentapeptide repeat protein QnrS1	core	AMR	AMR	QUINOLONE	QUINOLONE	ALLELEP	218	218	100.00	100.00	218	WP_001516695.1	quinolone resistance pentapeptide repeat protein QnrS1	NF000056.3	QnrS family quinolone resistance pentapeptide repeat protein
ERR16718619	ERR16718619_05700	gnl|Bactopia|ERR16718619_169	1492	2289	-	blaOXA-48	OXA-48 family carbapenem-hydrolyzing class D beta-lactamase OXA-48	core	AMR	AMR	BETA-LACTAM	CARBAPENEM	ALLELEP	265	265	100.00	100.00	265	WP_015059991.1	OXA-48 family carbapenem-hydrolyzing class D beta-lactamase OXA-48	NF000387.2	OXA-48 family class D beta-lactamase
ERR16718619	ERR16718619_02018	gnl|Bactopia|ERR16718619_17	28695	29870	+	oqxA	multidrug efflux RND transporter periplasmic adaptor subunit OqxA	core	AMR	AMR	PHENICOL/QUINOLONE	PHENICOL/QUINOLONE	EXACTP	391	391	100.00	100.00	391	WP_002914189.1	multidrug efflux RND transporter periplasmic adaptor subunit OqxA	NF000272.1	multidrug efflux RND transporter periplasmic adaptor subunit OqxA
ERR16718619	ERR16718619_02019	gnl|Bactopia|ERR16718619_17	29894	33046	+	oqxB	multidrug efflux RND transporter permease subunit OqxB	core	AMR	AMR	PHENICOL/QUINOLONE	PHENICOL/QUINOLONE	BLASTP	1050	1050	100.00	99.90	1050	WP_021312368.1	multidrug efflux RND transporter permease subunit OqxB20	NF000037.1	multidrug efflux RND transporter permease subunit OqxB
ERR16718619	ERR16718619_00424	gnl|Bactopia|ERR16718619_2	208301	209533	-	kdeA	multidrug efflux MFS transporter KdeA	plus	AMR	AMR	EFFLUX	EFFLUX	EXACTP	410	410	100.00	100.00	410	ABR76310.1	multidrug efflux MFS transporter KdeA	NA	NA
ERR16718619	ERR16718619_02481	gnl|Bactopia|ERR16718619_22	79745	80929	-	emrD	multidrug efflux MFS transporter EmrD	plus	AMR	AMR	EFFLUX	EFFLUX	BLASTP	394	394	100.00	99.49	394	ACN65732.1	multidrug efflux MFS transporter EmrD	NA	NA
ERR16718619	NA	gnl|Bactopia|ERR16718619_220	3	776	-	sul1	sulfonamide-resistant dihydropteroate synthase Sul1	core	AMR	AMR	SULFONAMIDE	SULFONAMIDE	BLASTX	258	279	92.47	100.00	258	WP_000259031.1	sulfonamide-resistant dihydropteroate synthase Sul1	NA	NA
ERR16718619	NA	gnl|Bactopia|ERR16718619_220	773	1108	-	qacE	quaternary ammonium compound efflux SMR transporter QacE	core	STRESS	BIOCIDE	QUATERNARY AMMONIUM	QUATERNARY AMMONIUM	BLASTX	112	115	97.39	100.00	112	WP_000679427.1	quaternary ammonium compound efflux SMR transporter QacE delta 1	NA	NA
ERR16718619	ERR16718619_05782	gnl|Bactopia|ERR16718619_236	47	580	-	ant(2'')-Ia	aminoglycoside nucleotidyltransferase ANT(2'')-Ia	core	AMR	AMR	AMINOGLYCOSIDE	GENTAMICIN/KANAMYCIN/TOBRAMYCIN	EXACTP	177	177	100.00	100.00	177	WP_000381802.1	aminoglycoside nucleotidyltransferase ANT(2'')-Ia	NF000064.3	aminoglycoside nucleotidyltransferase ANT(2'')-Ia
ERR16718619	ERR16718619_02579	gnl|Bactopia|ERR16718619_24	9008	9586	-	terD	tellurium resistance membrane protein TerD	plus	STRESS	METAL	TELLURIUM	TELLURIUM	BLASTP	192	192	100.00	95.83	192	AAA98292.1	tellurium resistance membrane protein TerD	NA	NA
ERR16718619	ERR16718619_02583	gnl|Bactopia|ERR16718619_24	12333	12914	-	terZ	tellurium resistance-associated protein TerZ	plus	STRESS	METAL	TELLURIUM	TELLURIUM	BLASTP	193	193	100.00	96.37	193	AAA86846.1	tellurium resistance-associated protein TerZ	NA	NA
ERR16718619	ERR16718619_02590	gnl|Bactopia|ERR16718619_24	19487	19954	+	terW	tellurium resistance protein TerW	plus	STRESS	METAL	TELLURIUM	TELLURIUM	EXACTP	155	155	100.00	100.00	155	AAC44736.1	tellurium resistance protein TerW	NA	NA
ERR16718619	ERR16718619_05785	gnl|Bactopia|ERR16718619_240	74	547	-	dfrA25	trimethoprim-resistant dihydrofolate reductase DfrA25	core	AMR	AMR	TRIMETHOPRIM	TRIMETHOPRIM	EXACTP	157	157	100.00	100.00	157	WP_029391998.1	trimethoprim-resistant dihydrofolate reductase DfrA25	NF000330.1	trimethoprim-resistant dihydrofolate reductase DfrA
ERR16718619	ERR16718619_05793	gnl|Bactopia|ERR16718619_253	83	517	-	catA2	type A-2 chloramphenicol O-acetyltransferase CatII	core	AMR	AMR	PHENICOL	CHLORAMPHENICOL	PARTIALP	144	213	67.61	100.00	144	WP_001011939.1	type A-2 chloramphenicol O-acetyltransferase CatII	NA	NA
ERR16718619	ERR16718619_02843	gnl|Bactopia|ERR16718619_27	25309	25731	-	arsC	glutaredoxin-dependent arsenate reductase	plus	STRESS	METAL	ARSENIC	ARSENATE	HMM	140	141	98.58	78.42	139	AAA21096.1	glutaredoxin-dependent arsenate reductase	NF007456.1	glutaredoxin-dependent arsenate reductase
ERR16718619	ERR16718619_03221	gnl|Bactopia|ERR16718619_32	31068	31970	+	fieF	CDF family cation-efflux transporter FieF	plus	STRESS	METAL	NA	NA	EXACTP	300	300	100.00	100.00	300	BAB89353.1	CDF family cation-efflux transporter FieF	NA	NA
ERR16718619	ERR16718619_03631	gnl|Bactopia|ERR16718619_38	47642	48502	+	blaSHV-28	broad-spectrum class A beta-lactamase SHV-28	core	AMR	AMR	BETA-LACTAM	BETA-LACTAM	ALLELEP	286	286	100.00	100.00	286	WP_004179754.1	broad-spectrum class A beta-lactamase SHV-28	NF000285.3	SHV family class A beta-lactamase
ERR16718619	ERR16718619_04177	gnl|Bactopia|ERR16718619_49	41796	43094	+	ncrA	nickel resistance membrane nickel efflux protein NcrA	plus	STRESS	METAL	NICKEL	NICKEL	EXACTP	432	432	100.00	100.00	432	ABF61434.1	nickel resistance membrane nickel efflux protein NcrA	NA	NA
ERR16718619	ERR16718619_04178	gnl|Bactopia|ERR16718619_49	43200	43469	+	ncrB	nickel-sensing transcriptional repressor NcrB	plus	STRESS	METAL	NICKEL	NICKEL	EXACTP	89	89	100.00	100.00	89	ABF61435.1	nickel-sensing transcriptional repressor NcrB	NA	NA
ERR16718619	ERR16718619_04179	gnl|Bactopia|ERR16718619_49	43482	44612	+	ncrC	Ni(II)/Co(II) efflux transporter permease subunit NcrC	plus	STRESS	METAL	COPPER/NICKEL	COPPER/NICKEL	EXACTP	376	376	100.00	100.00	376	ADF64798.1	Ni(II)/Co(II) efflux transporter permease subunit NcrC	NA	NA
ERR16718619	NA	gnl|Bactopia|ERR16718619_49	44774	45193	+	ncrY	nickel resistance OB fold protein NcrY	plus	STRESS	METAL	NICKEL	NICKEL	EXACTX	140	140	100.00	100.00	140	ABF61437.1	nickel resistance OB fold protein NcrY	NA	NA
ERR16718619	ERR16718619_04321	gnl|Bactopia|ERR16718619_53	15775	16206	-	silE	silver-binding protein SilE	plus	STRESS	METAL	SILVER	SILVER	BLASTP	143	143	100.00	92.31	143	AAD11743.1	silver-binding protein SilE	NA	NA
ERR16718619	ERR16718619_04322	gnl|Bactopia|ERR16718619_53	16457	17932	-	silS	copper/silver sensor histidine kinase SilS	plus	STRESS	METAL	COPPER/SILVER	COPPER/SILVER	BLASTP	491	491	100.00	98.98	491	SPD96882.1	copper/silver sensor histidine kinase SilS	NA	NA
ERR16718619	ERR16718619_04323	gnl|Bactopia|ERR16718619_53	17925	18605	-	silR	copper/silver response regulator transcription factor SilR	plus	STRESS	METAL	COPPER/SILVER	COPPER/SILVER	BLASTP	226	226	100.00	98.23	226	SPD96883.1	copper/silver response regulator transcription factor SilR	NA	NA
ERR16718619	ERR16718619_04324	gnl|Bactopia|ERR16718619_53	18795	20180	+	silC	Cu(+)/Ag(+) efflux RND transporter outer membrane channel SilC	plus	STRESS	METAL	COPPER/SILVER	COPPER/SILVER	BLASTP	461	461	100.00	99.57	461	SPD96884.1	Cu(+)/Ag(+) efflux RND transporter outer membrane channel SilC	NA	NA
ERR16718619	ERR16718619_04325	gnl|Bactopia|ERR16718619_53	20209	20562	+	silF	Cu(+)/Ag(+) efflux RND transporter periplasmic metallochaperone SilF	plus	STRESS	METAL	COPPER/SILVER	COPPER/SILVER	BLASTP	117	117	100.00	99.15	117	KGL71342.1	Cu(+)/Ag(+) efflux RND transporter periplasmic metallochaperone SilF	NA	NA
ERR16718619	ERR16718619_04326	gnl|Bactopia|ERR16718619_53	20676	21968	+	silB	Cu(+)/Ag(+) efflux RND transporter periplasmic adaptor subunit SilB	plus	STRESS	METAL	COPPER/SILVER	COPPER/SILVER	BLASTP	430	430	100.00	97.91	430	AAD11748.1	Cu(+)/Ag(+) efflux RND transporter periplasmic adaptor subunit SilB	NA	NA
ERR16718619	ERR16718619_04327	gnl|Bactopia|ERR16718619_53	21979	25125	+	silA	Cu(+)/Ag(+) efflux RND transporter permease subunit SilA	plus	STRESS	METAL	COPPER/SILVER	COPPER/SILVER	BLASTP	1048	1048	100.00	98.76	1048	AAD11749.1	Cu(+)/Ag(+) efflux RND transporter permease subunit SilA	NA	NA
ERR16718619	ERR16718619_04329	gnl|Bactopia|ERR16718619_53	25779	28226	+	silP	Ag(+)-translocating P-type ATPase SilP	plus	STRESS	METAL	SILVER	SILVER	BLASTP	815	824	98.79	94.49	816	AAD11750.1	Ag(+)-translocating P-type ATPase SilP	NA	NA
ERR16718619	ERR16718619_04333	gnl|Bactopia|ERR16718619_53	30207	32024	+	pcoA	multicopper oxidase PcoA	plus	STRESS	METAL	COPPER	COPPER	BLASTP	605	605	100.00	99.83	605	CAA58525.1	multicopper oxidase PcoA	NA	NA
